[
  {
    "id": "-OFglRwSBwjHIsUgDsQI",
    "amount": 14000,
    "boxing": false,
    "client_key": "tCOViwVfG9BdLxzCoMav",
    "exp_date": "17/01/2025",
    "hist_type": "Renewal",
    "history_id": "45341735896110236000",
    "pt_plan": "null",
    "pt_status": false,
    "sub_date": "03/01/2025",
    "sub_plan": "Fortnightly",
    "sub_type": "Individual",
    "time_stamp": "2025-01-03 10:21:50.594"
  },
  {
    "id": "-OFglrg_xuykCdhO-Bap",
    "amount": 25000,
    "boxing": false,
    "client_key": "BmOyqnwFQGVcmjQFwEsp",
    "exp_date": "03/02/2025",
    "hist_type": "Registration",
    "history_id": "07241735909590544000",
    "pt_plan": "null",
    "pt_status": false,
    "sub_date": "03/01/2025",
    "sub_plan": "Monthly",
    "sub_type": "Individual",
    "time_stamp": "2025-01-03 14:06:31.333"
  },
  {
    "id": "-OFglrgc8RiXCG34KuY3",
    "amount": 0,
    "boxing": false,
    "client_key": "BmOyqnwFQGVcmjQFwEsp",
    "exp_date": "03/02/2025",
    "hist_type": "Subscription Paused",
    "history_id": "38001735909623169000",
    "pt_plan": "",
    "pt_status": false,
    "sub_date": "03/01/2025",
    "sub_plan": "Monthly",
    "sub_type": "Individual",
    "time_stamp": "2025-01-03 14:07:03.169"
  },
  {
    "id": "-OFkG7C7-Qv6oQKld-4m",
    "amount": 20000,
    "boxing": false,
    "client_key": "U2orJygIdCDKdetkomRj",
    "exp_date": "04/02/2025",
    "hist_type": "Renewal",
    "history_id": "77741735976584572000",
    "pt_plan": "null",
    "pt_status": false,
    "sub_date": "04/01/2025",
    "sub_plan": "Monthly",
    "sub_type": "Individual",
    "time_stamp": "2025-01-04 08:43:04.934"
  },
  {
    "id": "-OFkGttg2BemWp0AFt7o",
    "amount": 25000,
    "boxing": false,
    "client_key": "nt6fS4XYx5sHQNzP00q3",
    "exp_date": "04/02/2025",
    "hist_type": "Registration",
    "history_id": "76331735976788161000",
    "pt_plan": "null",
    "pt_status": false,
    "sub_date": "04/01/2025",
    "sub_plan": "Monthly",
    "sub_type": "Individual",
    "time_stamp": "2025-01-04 08:46:28.492"
  },
  {
    "id": "-OFkMEyYsQMUUIRYfd3S",
    "amount": 23000,
    "boxing": false,
    "client_key": "KHtHO9rcfU63vS27vCBw",
    "exp_date": "04/02/2025",
    "extras_amount": 15000,
    "hist_type": "Registration",
    "history_id": "02801735978188470000",
    "pt_plan": "Premium",
    "pt_status": true,
    "sub_date": "04/01/2025",
    "sub_plan": "HMO Hybrid",
    "sub_type": "HMO Plan",
    "time_stamp": "2025-01-04 09:09:49.548"
  },
  {
    "id": "-OFkMWRXZpHfs7uMtolF",
    "amount": 0,
    "boxing": false,
    "client_key": "KHtHO9rcfU63vS27vCBw",
    "exp_date": "04/02/2025",
    "hist_type": "Subscription Paused",
    "history_id": "55201735978261098000",
    "pt_plan": "",
    "pt_status": false,
    "sub_date": "04/01/2025",
    "sub_plan": "HMO Hybrid",
    "sub_type": "HMO Plan",
    "time_stamp": "2025-01-04 09:11:01.099"
  },
  {
    "id": "-OFkMg9Wrr8misSPYEyO",
    "amount": 3000,
    "boxing": false,
    "client_key": "KHtHO9rcfU63vS27vCBw",
    "exp_date": "05/01/2025",
    "hist_type": "Renewal",
    "history_id": "92561735978304653000",
    "pt_plan": "null",
    "pt_status": false,
    "sub_date": "04/01/2025",
    "sub_plan": "Daily",
    "sub_type": "Individual",
    "time_stamp": "2025-01-04 09:11:45.004"
  },
  {
    "id": "-OFkniI2Froy7nwrCMd1",
    "amount": 8000,
    "boxing": false,
    "client_key": "uYEGtApbLgUE7hz5GESX",
    "exp_date": "11/01/2025",
    "hist_type": "Renewal",
    "history_id": "34601735985658668000",
    "pt_plan": "null",
    "pt_status": false,
    "sub_date": "04/01/2025",
    "sub_plan": "Weekly",
    "sub_type": "Individual",
    "time_stamp": "2025-01-04 11:14:19.112"
  },
  {
    "id": "-OFutvOHPOG8leWtoI0x",
    "amount": 20000,
    "boxing": false,
    "client_key": "1VvjP9QIh0EtQufh6kMs",
    "exp_date": "06/02/2025",
    "hist_type": "Renewal",
    "history_id": "39971736155022022000",
    "pt_plan": "null",
    "pt_status": false,
    "sub_date": "06/01/2025",
    "sub_plan": "Monthly",
    "sub_type": "Individual",
    "time_stamp": "2025-01-06 10:17:31.264"
  },
  {
    "id": "-OFuwgsMvxCLb7j1qdTk",
    "amount": 35000,
    "boxing": false,
    "client_key": "jzqdEe3xOtHMYV9mwkXV",
    "exp_date": "06/02/2025",
    "extras_amount": 10000,
    "hist_type": "Registration",
    "history_id": "91311736155777736000",
    "pt_plan": "Standard",
    "pt_status": true,
    "sub_date": "06/01/2025",
    "sub_plan": "Monthly",
    "sub_type": "Individual",
    "time_stamp": "2025-01-06 10:29:38.165"
  },
  {
    "id": "-OFux6Q6DlPVjtFaBOmL",
    "amount": 3000,
    "boxing": false,
    "client_key": "WqhbBAzU4oz3Bh4ftGKj",
    "exp_date": "07/01/2025",
    "hist_type": "Renewal",
    "history_id": "02671736155886257000",
    "pt_plan": "null",
    "pt_status": false,
    "sub_date": "06/01/2025",
    "sub_plan": "Daily",
    "sub_type": "Individual",
    "time_stamp": "2025-01-06 10:31:26.885"
  },
  {
    "id": "-OFuxU10Mu6V2oyz9Gg-",
    "amount": 20000,
    "boxing": false,
    "client_key": "lwZXPWmRyaO4eifOZvda",
    "exp_date": "06/02/2025",
    "hist_type": "Renewal",
    "history_id": "08191736155983193000",
    "pt_plan": "null",
    "pt_status": false,
    "sub_date": "06/01/2025",
    "sub_plan": "Monthly",
    "sub_type": "Individual",
    "time_stamp": "2025-01-06 10:33:03.583"
  },
  {
    "id": "-OFv46TGQ0xRE8IjTVqR",
    "amount": 25000,
    "boxing": false,
    "client_key": "datPntjQI3Em4J2MttEl",
    "exp_date": "06/02/2025",
    "hist_type": "Registration",
    "history_id": "79021736157984084000",
    "pt_plan": "null",
    "pt_status": false,
    "sub_date": "06/01/2025",
    "sub_plan": "Monthly",
    "sub_type": "Individual",
    "time_stamp": "2025-01-06 11:06:25.227"
  },
  {
    "id": "-OFwKnDpIz01n9SEifEg",
    "amount": 20000,
    "boxing": false,
    "client_key": "FOq2hecmypSX2WZaw1Kp",
    "exp_date": "06/02/2025",
    "hist_type": "Renewal",
    "history_id": "17211736179133270000",
    "pt_plan": "null",
    "pt_status": false,
    "sub_date": "06/01/2025",
    "sub_plan": "Monthly",
    "sub_type": "Individual",
    "time_stamp": "2025-01-06 16:58:54.405"
  },
  {
    "id": "-OFwVtGpgdq0FnEy1AoN",
    "amount": 20000,
    "boxing": false,
    "client_key": "hyzKNXE5FvSEx03m237Z",
    "exp_date": "06/02/2025",
    "hist_type": "Renewal",
    "history_id": "08171736182039953000",
    "pt_plan": "null",
    "pt_status": false,
    "sub_date": "06/01/2025",
    "sub_plan": "Monthly",
    "sub_type": "Individual",
    "time_stamp": "2025-01-06 17:47:22.892"
  },
  {
    "id": "-OFwXK33drEl4Eb1xmuM",
    "amount": 25000,
    "boxing": false,
    "client_key": "PnonLR2VylIcd9GA3aSu",
    "exp_date": "06/02/2025",
    "hist_type": "Registration",
    "history_id": "54861736182420638000",
    "pt_plan": "null",
    "pt_status": false,
    "sub_date": "06/01/2025",
    "sub_plan": "Monthly",
    "sub_type": "Individual",
    "time_stamp": "2025-01-06 17:53:41.603"
  },
  {
    "id": "-OFwZEQzTH2__aFp7u0D",
    "amount": 25000,
    "boxing": false,
    "client_key": "SoeRUDfhQYJSLL0FhlBi",
    "exp_date": "06/02/2025",
    "hist_type": "Registration",
    "history_id": "61741736182918842000",
    "pt_plan": "null",
    "pt_status": false,
    "sub_date": "06/01/2025",
    "sub_plan": "Monthly",
    "sub_type": "Individual",
    "time_stamp": "2025-01-06 18:01:59.944"
  },
  {
    "id": "-OFwZR6vwJLDDS9Eb9wm",
    "amount": 0,
    "boxing": false,
    "client_key": "KHtHO9rcfU63vS27vCBw",
    "exp_date": "06/02/2025",
    "hist_type": "Subscription Resumed",
    "history_id": "33511736182971909000",
    "pt_plan": "",
    "pt_status": false,
    "sub_date": "06/01/2025",
    "sub_plan": "HMO Hybrid",
    "sub_type": "HMO Plan",
    "time_stamp": "2025-01-06 18:02:51.910"
  },
  {
    "id": "-OFwbAmFdUvx9GHCpSyT",
    "amount": 20000,
    "boxing": false,
    "client_key": "z8zp90GvHljLOJ2JpgT8",
    "exp_date": "06/02/2025",
    "hist_type": "Renewal",
    "history_id": "49681736183691992000",
    "pt_plan": "null",
    "pt_status": false,
    "sub_date": "06/01/2025",
    "sub_plan": "Monthly",
    "sub_type": "Individual",
    "time_stamp": "2025-01-06 18:14:52.320"
  },
  {
    "id": "-OFwbK8rjqLJ6srn6cZc",
    "amount": 0,
    "boxing": false,
    "client_key": "z8zp90GvHljLOJ2JpgT8",
    "exp_date": "06/02/2025",
    "hist_type": "Subscription Paused",
    "history_id": "21171736183730694000",
    "pt_plan": "",
    "pt_status": false,
    "sub_date": "06/01/2025",
    "sub_plan": "Monthly",
    "sub_type": "Individual",
    "time_stamp": "2025-01-06 18:15:30.695"
  },
  {
    "id": "-OFwfqscVOdvwcOYoS7G",
    "amount": 20000,
    "boxing": false,
    "client_key": "yAQR0TKICS3SjSNGBPMa",
    "exp_date": "06/02/2025",
    "hist_type": "Renewal",
    "history_id": "59611736184915422000",
    "pt_plan": "null",
    "pt_status": false,
    "sub_date": "06/01/2025",
    "sub_plan": "Monthly",
    "sub_type": "Individual",
    "time_stamp": "2025-01-06 18:35:18.134"
  },
  {
    "id": "-OFwnP8mE3z4u6-N47n5",
    "amount": 20000,
    "boxing": false,
    "client_key": "c0m6goNcbi6QuvbK8pMT",
    "exp_date": "06/02/2025",
    "extras_amount": 0,
    "hist_type": "Renewal",
    "history_id": "12081736186895501000",
    "pt_plan": "null",
    "pt_status": false,
    "sub_date": "06/01/2025",
    "sub_plan": "Monthly",
    "sub_type": "Individual",
    "time_stamp": "2025-01-06 19:08:15.870"
  },
  {
    "id": "-OFwy5Wk_LcB6JhLxPq7",
    "amount": 20000,
    "boxing": false,
    "client_key": "2En3xSXPAgnTnesHhsjd",
    "exp_date": "06/02/2025",
    "extras_amount": 0,
    "hist_type": "Renewal",
    "history_id": "14401736189699630000",
    "pt_plan": "null",
    "pt_status": false,
    "sub_date": "06/01/2025",
    "sub_plan": "Monthly",
    "sub_type": "Individual",
    "time_stamp": "2025-01-06 19:55:00.702"
  },
  {
    "id": "-OFzoJoOmFGIouqcDi9R",
    "amount": 20000,
    "boxing": false,
    "client_key": "pch99OcwfgpPQrD3Rll9",
    "exp_date": "07/02/2025",
    "extras_amount": 0,
    "hist_type": "Renewal",
    "history_id": "74681736237468619000",
    "pt_plan": "null",
    "pt_status": false,
    "sub_date": "07/01/2025",
    "sub_plan": "Monthly",
    "sub_type": "Individual",
    "time_stamp": "2025-01-07 09:11:10.564"
  },
  {
    "id": "-OFzohTiZtwPjWc9LiUt",
    "amount": 0,
    "boxing": false,
    "client_key": "z8zp90GvHljLOJ2JpgT8",
    "exp_date": "07/02/2025",
    "extras_amount": 0,
    "hist_type": "Subscription Resumed",
    "history_id": "26061736237571582000",
    "pt_plan": "",
    "pt_status": false,
    "sub_date": "07/01/2025",
    "sub_plan": "Monthly",
    "sub_type": "Individual",
    "time_stamp": "2025-01-07 09:12:51.582"
  },
  {
    "id": "-OFzpEFInNQeK8ZidXl1",
    "amount": 20000,
    "boxing": false,
    "client_key": "69cOLZmxJPH5MfZ9W32f",
    "exp_date": "07/02/2025",
    "extras_amount": 0,
    "hist_type": "Renewal",
    "history_id": "80841736237706845000",
    "pt_plan": "null",
    "pt_status": false,
    "sub_date": "07/01/2025",
    "sub_plan": "Monthly",
    "sub_type": "Individual",
    "time_stamp": "2025-01-07 09:15:08.897"
  },
  {
    "id": "-OFzqNLK4oWsok7VQqi8",
    "amount": 20000,
    "boxing": false,
    "client_key": "JZrvw2vnGaqrBI2jXST7",
    "exp_date": "07/02/2025",
    "extras_amount": 0,
    "hist_type": "Renewal",
    "history_id": "30211736238007834000",
    "pt_plan": "null",
    "pt_status": false,
    "sub_date": "07/01/2025",
    "sub_plan": "Monthly",
    "sub_type": "Individual",
    "time_stamp": "2025-01-07 09:20:08.292"
  },
  {
    "id": "-OFzqa7MCDN6Ye7afnoq",
    "amount": 19000,
    "boxing": false,
    "client_key": "UvaPdKg5DNUV7FDTJGLh",
    "exp_date": "07/02/2025",
    "extras_amount": 0,
    "hist_type": "Renewal",
    "history_id": "44381736238064230000",
    "pt_plan": "null",
    "pt_status": false,
    "sub_date": "07/01/2025",
    "sub_plan": "Monthly",
    "sub_type": "Couples",
    "time_stamp": "2025-01-07 09:21:04.742"
  },
  {
    "id": "-OFzqhrpRpYbaE9Qe3kw",
    "amount": 19000,
    "boxing": false,
    "client_key": "5uq5wBuYOJetBiYCKV8H",
    "exp_date": "07/02/2025",
    "extras_amount": 0,
    "hist_type": "Renewal",
    "history_id": "10091736238095932000",
    "pt_plan": "null",
    "pt_status": false,
    "sub_date": "07/01/2025",
    "sub_plan": "Monthly",
    "sub_type": "Couples",
    "time_stamp": "2025-01-07 09:21:36.452"
  },
  {
    "id": "-OFzrQI0fwDoHYt3yyyf",
    "amount": 0,
    "boxing": false,
    "client_key": "BmOyqnwFQGVcmjQFwEsp",
    "exp_date": "07/02/2025",
    "extras_amount": 0,
    "hist_type": "Subscription Resumed",
    "history_id": "19651736238282496000",
    "pt_plan": "",
    "pt_status": false,
    "sub_date": "07/01/2025",
    "sub_plan": "Monthly",
    "sub_type": "Individual",
    "time_stamp": "2025-01-07 09:24:42.496"
  },
  {
    "id": "-OFzriKY2r3e4eKdF_W4",
    "amount": 19000,
    "boxing": false,
    "client_key": "cjuU4ireAaADeZMtN4fE",
    "exp_date": "07/02/2025",
    "extras_amount": 0,
    "hist_type": "Renewal",
    "history_id": "37231736238357959000",
    "pt_plan": "null",
    "pt_status": false,
    "sub_date": "07/01/2025",
    "sub_plan": "Monthly",
    "sub_type": "Couples",
    "time_stamp": "2025-01-07 09:26:00.483"
  },
  {
    "id": "-OFzs8LAne4EevjxTH78",
    "amount": 19000,
    "boxing": false,
    "client_key": "qYQAfekf5m0sA8m5jLrA",
    "exp_date": "07/02/2025",
    "extras_amount": 0,
    "hist_type": "Renewal",
    "history_id": "40801736238455718000",
    "pt_plan": "null",
    "pt_status": false,
    "sub_date": "07/01/2025",
    "sub_plan": "Monthly",
    "sub_type": "Couples",
    "time_stamp": "2025-01-07 09:27:51.114"
  },
  {
    "id": "-OFztcKNKqzjA-fABezf",
    "amount": 20000,
    "boxing": false,
    "client_key": "0vu2jaE4Ryqu2DrkHkI6",
    "exp_date": "07/02/2025",
    "extras_amount": 0,
    "hist_type": "Renewal",
    "history_id": "47701736238853131000",
    "pt_plan": "null",
    "pt_status": false,
    "sub_date": "07/01/2025",
    "sub_plan": "Monthly",
    "sub_type": "Individual",
    "time_stamp": "2025-01-07 09:34:20.183"
  },
  {
    "id": "-OG0uxu8R62Xw-wIeB4U",
    "amount": 25000,
    "boxing": false,
    "client_key": "66LbeK2Tvc9dLfv6ESXh",
    "exp_date": "07/02/2025",
    "extras_amount": 0,
    "hist_type": "Registration",
    "history_id": "79361736272766467000",
    "pt_plan": "null",
    "pt_status": false,
    "sub_date": "07/01/2025",
    "sub_plan": "Monthly",
    "sub_type": "Individual",
    "time_stamp": "2025-01-07 18:59:27.121"
  },
  {
    "id": "-OG0vHMbc8m3xgNAzy9h",
    "amount": 25000,
    "boxing": false,
    "client_key": "kGgKCQ4VlRIVMFdwPE1V",
    "exp_date": "07/02/2025",
    "extras_amount": 0,
    "hist_type": "Registration",
    "history_id": "40371736272850571000",
    "pt_plan": "null",
    "pt_status": false,
    "sub_date": "07/01/2025",
    "sub_plan": "Monthly",
    "sub_type": "Individual",
    "time_stamp": "2025-01-07 19:00:50.931"
  },
  {
    "id": "-OG3s8lfOElQkZBstZAR",
    "amount": 25000,
    "boxing": false,
    "client_key": "tW3SxHxS3FdiaDDRJ6RK",
    "exp_date": "08/02/2025",
    "extras_amount": 0,
    "hist_type": "Registration",
    "history_id": "41821736322358182000",
    "pt_plan": "null",
    "pt_status": false,
    "sub_date": "08/01/2025",
    "sub_plan": "Monthly",
    "sub_type": "Individual",
    "time_stamp": "2025-01-08 08:45:58.871"
  },
  {
    "id": "-OG3sWGjlm85WEiJStcN",
    "amount": 0,
    "boxing": false,
    "client_key": "kL7HOfEHzmpvRtEPQRg8",
    "exp_date": "11/03/2025",
    "extras_amount": 0,
    "hist_type": "Subscription Resumed",
    "history_id": "19051736322454994000",
    "pt_plan": "",
    "pt_status": false,
    "sub_date": "08/01/2025",
    "sub_plan": "2 Months",
    "sub_type": "Individual",
    "time_stamp": "2025-01-08 08:47:34.994"
  },
  {
    "id": "-OG3xkUTVHlJJNTbhEDG",
    "amount": 20000,
    "boxing": false,
    "client_key": "jF9bur83KvHJUEsZEgs4",
    "exp_date": "06/02/2025",
    "extras_amount": 0,
    "hist_type": "Renewal",
    "history_id": "51191736323826860000",
    "pt_plan": "null",
    "pt_status": false,
    "sub_date": "08/01/2025",
    "sub_plan": "Monthly",
    "sub_type": "Individual",
    "time_stamp": "2025-01-08 09:10:27.999"
  },
  {
    "id": "-OG3zb_x8cr26UFYrYYS",
    "amount": 20000,
    "boxing": false,
    "client_key": "f0pQTAucKIX0e1Ok0YnS",
    "exp_date": "08/02/2025",
    "extras_amount": 0,
    "hist_type": "Renewal",
    "history_id": "45511736324314564000",
    "pt_plan": "null",
    "pt_status": false,
    "sub_date": "08/01/2025",
    "sub_plan": "Monthly",
    "sub_type": "Individual",
    "time_stamp": "2025-01-08 09:18:35.841"
  },
  {
    "id": "-OG44ieBvpxaS2oqSaO2",
    "amount": 35000,
    "boxing": false,
    "client_key": "HEHm7BfStp9UVMylTUWN",
    "exp_date": "08/02/2025",
    "extras_amount": 15000,
    "hist_type": "Renewal",
    "history_id": "72931736325891079000",
    "pt_plan": "Standard",
    "pt_status": true,
    "sub_date": "08/01/2025",
    "sub_plan": "Monthly",
    "sub_type": "Individual",
    "time_stamp": "2025-01-08 09:45:18.026"
  },
  {
    "id": "-OG476D2363-WH_K7waM",
    "amount": 20000,
    "boxing": false,
    "client_key": "jzIHJ3IeeMjfVc1R5wmh",
    "exp_date": "08/02/2025",
    "extras_amount": 0,
    "hist_type": "Renewal",
    "history_id": "24241736326534405000",
    "pt_plan": "null",
    "pt_status": false,
    "sub_date": "08/01/2025",
    "sub_plan": "Monthly",
    "sub_type": "Individual",
    "time_stamp": "2025-01-08 09:55:42.976"
  },
  {
    "id": "-OG4B8524zxkKE5dX6Qa",
    "amount": 15000,
    "boxing": false,
    "client_key": "BmOyqnwFQGVcmjQFwEsp",
    "exp_date": "08/02/2025",
    "extras_amount": 0,
    "hist_type": "Personal Training",
    "history_id": "32321736327599234000",
    "pt_plan": "",
    "pt_status": false,
    "sub_date": "08/01/2025",
    "sub_plan": "Standard Plan",
    "sub_type": "",
    "time_stamp": "2025-01-08 10:13:19.234"
  },
  {
    "id": "-OG4arQfFVruPYMIQ9hW",
    "amount": 20000,
    "boxing": false,
    "client_key": "mYZ4Ix4mNbcE8uj9KEfV",
    "exp_date": "08/02/2025",
    "extras_amount": 0,
    "hist_type": "Renewal",
    "history_id": "89141736334602791000",
    "pt_plan": "null",
    "pt_status": false,
    "sub_date": "08/01/2025",
    "sub_plan": "Monthly",
    "sub_type": "Individual",
    "time_stamp": "2025-01-08 12:10:03.921"
  },
  {
    "id": "-OG5sB0RPK5eSyCtYZVR",
    "amount": 3000,
    "boxing": false,
    "client_key": "rMg6UXRA5K7o2z85ywJr",
    "exp_date": "09/01/2025",
    "extras_amount": 0,
    "hist_type": "Renewal",
    "history_id": "11061736355921748000",
    "pt_plan": "null",
    "pt_status": false,
    "sub_date": "08/01/2025",
    "sub_plan": "Daily",
    "sub_type": "Individual",
    "time_stamp": "2025-01-08 18:05:22.112"
  },
  {
    "id": "-OG5sSDjrM8bwdMXJrSD",
    "amount": 3000,
    "boxing": false,
    "client_key": "7gFbPxCfYoD8dfOzdGjh",
    "exp_date": "09/01/2025",
    "extras_amount": 0,
    "hist_type": "Renewal",
    "history_id": "01391736355992210000",
    "pt_plan": "null",
    "pt_status": false,
    "sub_date": "08/01/2025",
    "sub_plan": "Daily",
    "sub_type": "Individual",
    "time_stamp": "2025-01-08 18:06:32.597"
  },
  {
    "id": "-OG5tv30g79FXTPaGcxU",
    "amount": 20000,
    "boxing": false,
    "client_key": "tdQNgUm2h8emGlfBzk5W",
    "exp_date": "08/02/2025",
    "extras_amount": 0,
    "hist_type": "Renewal",
    "history_id": "39411736356373811000",
    "pt_plan": "null",
    "pt_status": false,
    "sub_date": "08/01/2025",
    "sub_plan": "Monthly",
    "sub_type": "Individual",
    "time_stamp": "2025-01-08 18:12:56.936"
  },
  {
    "id": "-OG91z-RxGeeVpWTdKeu",
    "amount": 13000,
    "boxing": false,
    "client_key": "WqhbBAzU4oz3Bh4ftGKj",
    "exp_date": "16/01/2025",
    "extras_amount": 0,
    "hist_type": "Registration",
    "history_id": "82691736409071881000",
    "pt_plan": "null",
    "pt_status": false,
    "sub_date": "09/01/2025",
    "sub_plan": "Weekly",
    "sub_type": "Individual",
    "time_stamp": "2025-01-09 08:51:25.307"
  },
  {
    "id": "-OG945B2hcaNN9ti0dx-",
    "amount": 40000,
    "boxing": false,
    "client_key": "jc3uQllJdXAYVBsymxrj",
    "exp_date": "09/02/2025",
    "extras_amount": 15000,
    "hist_type": "Registration",
    "history_id": "62071736409635605000",
    "pt_plan": "Standard",
    "pt_status": true,
    "sub_date": "09/01/2025",
    "sub_plan": "Monthly",
    "sub_type": "Individual",
    "time_stamp": "2025-01-09 09:00:39.013"
  },
  {
    "id": "-OGA7CsQ-ffeFkhAZEdM",
    "amount": 20000,
    "boxing": false,
    "client_key": "cRI1UYaVfSa6HXeYBy4Y",
    "exp_date": "09/02/2025",
    "extras_amount": 0,
    "hist_type": "Renewal",
    "history_id": "78981736427232760000",
    "pt_plan": "null",
    "pt_status": false,
    "sub_date": "09/01/2025",
    "sub_plan": "Monthly",
    "sub_type": "Individual",
    "time_stamp": "2025-01-09 13:53:53.189"
  },
  {
    "id": "-OGA7d03MEpD-Crt17PL",
    "amount": 0,
    "boxing": false,
    "client_key": "cRI1UYaVfSa6HXeYBy4Y",
    "exp_date": "09/02/2025",
    "extras_amount": 0,
    "hist_type": "Subscription Paused",
    "history_id": "05761736427344336000",
    "pt_plan": "",
    "pt_status": false,
    "sub_date": "09/01/2025",
    "sub_plan": "Monthly",
    "sub_type": "Individual",
    "time_stamp": "2025-01-09 13:55:44.337"
  },
  {
    "id": "-OGBFHSXlKIJyk6apHxw",
    "amount": 0,
    "boxing": false,
    "client_key": "ZLRuMbRWj15KS30Ks5XT",
    "exp_date": "09/02/2025",
    "extras_amount": 0,
    "hist_type": "Subscription Paused",
    "history_id": "67561736446126367000",
    "pt_plan": "",
    "pt_status": false,
    "sub_date": "09/01/2025",
    "sub_plan": "Monthly",
    "sub_type": "Individual",
    "time_stamp": "2025-01-09 19:08:46.367"
  },
  {
    "id": "-OGBFdGNXlxFPqEw-qJ6",
    "amount": 2000,
    "boxing": false,
    "client_key": "DihCmRMzQYH28FCP8FBC",
    "exp_date": "10/01/2025",
    "extras_amount": 0,
    "hist_type": "Renewal",
    "history_id": "03891736446218380000",
    "pt_plan": "null",
    "pt_status": false,
    "sub_amount_b4_discount": 3000,
    "sub_date": "09/01/2025",
    "sub_plan": "Daily",
    "sub_type": "Individual",
    "time_stamp": "2025-01-09 19:10:19.798"
  },
  {
    "id": "-OGBFlm-z8Tu0jpbeNbL",
    "amount": 2500,
    "boxing": false,
    "client_key": "g7rHJ8Rn5mZg6BDydqRT",
    "exp_date": "10/01/2025",
    "extras_amount": 0,
    "hist_type": "Registration",
    "history_id": "53851736446254181000",
    "pt_plan": "null",
    "pt_status": false,
    "sub_date": "09/01/2025",
    "sub_plan": "Daily",
    "sub_type": "Family",
    "time_stamp": "2025-01-09 19:10:54.654"
  },
  {
    "id": "-OGBFwqVbIPtNKFEDwcW",
    "amount": 2500,
    "boxing": false,
    "client_key": "QI9xspIZrBkVj33RI7iV",
    "exp_date": "10/01/2025",
    "extras_amount": 0,
    "hist_type": "Renewal",
    "history_id": "38811736446299515000",
    "pt_plan": "null",
    "pt_status": false,
    "sub_date": "09/01/2025",
    "sub_plan": "Daily",
    "sub_type": "Family",
    "time_stamp": "2025-01-09 19:11:39.998"
  },
  {
    "id": "-OGBG5G_zqfr8yrFFMPy",
    "amount": 2500,
    "boxing": false,
    "client_key": "Wji8ZNhnmdzM1e02yr89",
    "exp_date": "10/01/2025",
    "extras_amount": 0,
    "hist_type": "Renewal",
    "history_id": "74811736446338117000",
    "pt_plan": "null",
    "pt_status": false,
    "sub_date": "09/01/2025",
    "sub_plan": "Daily",
    "sub_type": "Family",
    "time_stamp": "2025-01-09 19:12:18.596"
  },
  {
    "id": "-OGBG9nTQu9cjMxezVeJ",
    "amount": 2500,
    "boxing": false,
    "client_key": "kiJKYVIVZZO1MGXYIACo",
    "exp_date": "10/01/2025",
    "extras_amount": 0,
    "hist_type": "Renewal",
    "history_id": "53301736446356685000",
    "pt_plan": "null",
    "pt_status": false,
    "sub_date": "09/01/2025",
    "sub_plan": "Daily",
    "sub_type": "Family",
    "time_stamp": "2025-01-09 19:12:37.149"
  },
  {
    "id": "-OGFokXMTk1K7sD7mQOa",
    "amount": 40000,
    "boxing": false,
    "client_key": "GJER3re6001yznsXVRGo",
    "exp_date": "10/02/2025",
    "extras_amount": 15000,
    "hist_type": "Registration",
    "history_id": "65971736522795764000",
    "pt_plan": "Standard",
    "pt_status": true,
    "sub_date": "10/01/2025",
    "sub_plan": "Monthly",
    "sub_type": "Individual",
    "time_stamp": "2025-01-10 16:26:36.125"
  },
  {
    "id": "-OGFp6qypxuTPAGPxKby",
    "amount": 0,
    "boxing": false,
    "client_key": "GJER3re6001yznsXVRGo",
    "exp_date": "10/02/2025",
    "extras_amount": 0,
    "hist_type": "Subscription Paused",
    "history_id": "40211736522891657000",
    "pt_plan": "",
    "pt_status": false,
    "sub_date": "10/01/2025",
    "sub_plan": "Monthly",
    "sub_type": "Individual",
    "time_stamp": "2025-01-10 16:28:11.657"
  },
  {
    "id": "-OGGPcgCuMqfOb7XDlxB",
    "amount": 3000,
    "boxing": false,
    "client_key": "NlCRaEzD1dznEICHnYQX",
    "exp_date": "11/01/2025",
    "extras_amount": 0,
    "hist_type": "Renewal",
    "history_id": "82671736532725100000",
    "pt_plan": "null",
    "pt_status": false,
    "sub_date": "10/01/2025",
    "sub_plan": "Daily",
    "sub_type": "Individual",
    "time_stamp": "2025-01-10 19:12:05.455"
  },
  {
    "id": "-OGGRc5E4EDoUTvHz9_c",
    "amount": 3000,
    "boxing": false,
    "client_key": "7gFbPxCfYoD8dfOzdGjh",
    "exp_date": "11/01/2025",
    "extras_amount": 0,
    "hist_type": "Renewal",
    "history_id": "72341736533243166000",
    "pt_plan": "null",
    "pt_status": false,
    "sub_date": "10/01/2025",
    "sub_plan": "Daily",
    "sub_type": "Individual",
    "time_stamp": "2025-01-10 19:20:47.593"
  },
  {
    "id": "-OGJudzmd1RhIpEkuaBR",
    "amount": 3000,
    "boxing": false,
    "client_key": "NlCRaEzD1dznEICHnYQX",
    "exp_date": "12/01/2025",
    "extras_amount": 0,
    "hist_type": "Renewal",
    "history_id": "00301736591449005000",
    "pt_plan": "null",
    "pt_status": false,
    "sub_date": "11/01/2025",
    "sub_plan": "Daily",
    "sub_type": "Individual",
    "time_stamp": "2025-01-11 11:30:50.310"
  },
  {
    "id": "-OGThoqeO56nTQzYhn9k",
    "amount": 40000,
    "boxing": false,
    "client_key": "i8uhCDHme8M22RbOXqQj",
    "exp_date": "13/02/2025",
    "extras_amount": 15000,
    "hist_type": "Registration",
    "history_id": "75281736755860612000",
    "pt_plan": "Standard",
    "pt_status": true,
    "sub_date": "13/01/2025",
    "sub_plan": "Monthly",
    "sub_type": "Individual",
    "time_stamp": "2025-01-13 09:11:01.042"
  },
  {
    "id": "-OGThz_4p1E5s-rcLCXD",
    "amount": 0,
    "boxing": false,
    "client_key": "i8uhCDHme8M22RbOXqQj",
    "exp_date": "13/02/2025",
    "extras_amount": 0,
    "hist_type": "Subscription Paused",
    "history_id": "02411736755904977000",
    "pt_plan": "",
    "pt_status": false,
    "sub_date": "13/01/2025",
    "sub_plan": "Monthly",
    "sub_type": "Individual",
    "time_stamp": "2025-01-13 09:11:44.977"
  },
  {
    "id": "-OGTi9xj7oID-J6X0LBZ",
    "amount": 0,
    "boxing": false,
    "client_key": "GJER3re6001yznsXVRGo",
    "exp_date": "13/02/2025",
    "extras_amount": 0,
    "hist_type": "Subscription Resumed",
    "history_id": "04581736755951611000",
    "pt_plan": "",
    "pt_status": false,
    "sub_date": "13/01/2025",
    "sub_plan": "Monthly",
    "sub_type": "Individual",
    "time_stamp": "2025-01-13 09:12:31.611"
  },
  {
    "id": "-OGTmAlLAhZtFJO436dX",
    "amount": 19000,
    "boxing": false,
    "client_key": "4mx7y4SLX8rNL5C7zqeQ",
    "exp_date": "13/02/2025",
    "extras_amount": 0,
    "hist_type": "Renewal",
    "history_id": "30751736757003290000",
    "pt_plan": "null",
    "pt_status": false,
    "sub_date": "13/01/2025",
    "sub_plan": "Monthly",
    "sub_type": "Couples",
    "time_stamp": "2025-01-13 09:30:03.767"
  },
  {
    "id": "-OGTmicxXqmugApNTVvm",
    "amount": 19000,
    "boxing": false,
    "client_key": "23tZdzQSX5ZCaJi9psIQ",
    "exp_date": "13/02/2025",
    "extras_amount": 0,
    "hist_type": "Renewal",
    "history_id": "76501736757146179000",
    "pt_plan": "null",
    "pt_status": false,
    "sub_date": "13/01/2025",
    "sub_plan": "Monthly",
    "sub_type": "Couples",
    "time_stamp": "2025-01-13 09:32:26.591"
  },
  {
    "id": "-OGU2aD6oaFhwfr3rGLz",
    "amount": 0,
    "boxing": false,
    "client_key": "CBvE8sJ9Q5Og0Hb1COhR",
    "exp_date": "05/02/2025",
    "extras_amount": 0,
    "hist_type": "Subscription Resumed",
    "history_id": "63691736761568503000",
    "pt_plan": "",
    "pt_status": false,
    "sub_date": "13/01/2025",
    "sub_plan": "Monthly",
    "sub_type": "Individual",
    "time_stamp": "2025-01-13 10:46:08.503"
  },
  {
    "id": "-OGU4f-1WCh-KnO2bFwv",
    "amount": 13000,
    "boxing": false,
    "client_key": "Wzrria2CnsrPuRRnE3gu",
    "exp_date": "20/01/2025",
    "extras_amount": 0,
    "hist_type": "Registration",
    "history_id": "98341736762111840000",
    "pt_plan": "null",
    "pt_status": false,
    "sub_date": "13/01/2025",
    "sub_plan": "Weekly",
    "sub_type": "Individual",
    "time_stamp": "2025-01-13 10:55:12.371"
  },
  {
    "id": "-OGUDsn5UXEloL0gbKia",
    "amount": 20000,
    "boxing": false,
    "client_key": "m1YTRZQ2QyLC9ioCkMET",
    "exp_date": "13/02/2025",
    "extras_amount": 0,
    "hist_type": "Renewal",
    "history_id": "72861736764527489000",
    "pt_plan": "null",
    "pt_status": false,
    "sub_date": "13/01/2025",
    "sub_plan": "Monthly",
    "sub_type": "Individual",
    "time_stamp": "2025-01-13 11:35:27.983"
  },
  {
    "id": "-OGUlDgeqpouXbuChG3-",
    "amount": 20000,
    "boxing": false,
    "client_key": "8LfShC4OdhyyiRauJt7a",
    "exp_date": "21/04/2025",
    "extras_amount": 0,
    "hist_type": "Advanced Renewal",
    "history_id": "09701736773529394000",
    "pt_plan": "null",
    "pt_status": false,
    "sub_date": "13/01/2025",
    "sub_plan": "Monthly",
    "sub_type": "Individual",
    "time_stamp": "2025-01-13 14:05:30.652"
  },
  {
    "id": "-OGVczl4I4_UIN89srJm",
    "amount": 20000,
    "boxing": false,
    "client_key": "exTlnQ2c4jahk3EmUznf",
    "exp_date": "13/02/2025",
    "extras_amount": 0,
    "hist_type": "Renewal",
    "history_id": "95041736788148649000",
    "pt_plan": "null",
    "pt_status": false,
    "sub_date": "13/01/2025",
    "sub_plan": "Monthly",
    "sub_type": "Individual",
    "time_stamp": "2025-01-13 18:09:09.809"
  },
  {
    "id": "-OGZ2NMe6JTpMfmp7VFm",
    "amount": 20000,
    "boxing": false,
    "client_key": "ntNAuPV0RFTbwMnkoXKi",
    "exp_date": "14/02/2025",
    "extras_amount": 0,
    "hist_type": "Renewal",
    "history_id": "50001736845396100000",
    "pt_plan": "null",
    "pt_status": false,
    "sub_date": "14/01/2025",
    "sub_plan": "Monthly",
    "sub_type": "Individual",
    "time_stamp": "2025-01-14 10:03:16.481"
  },
  {
    "id": "-OGZ2sT6AhM-s2wXT5D5",
    "amount": 19000,
    "boxing": false,
    "client_key": "Dxfvuo7HNUoZA8XbAMoe",
    "exp_date": "14/02/2025",
    "extras_amount": 0,
    "hist_type": "Renewal",
    "history_id": "98001736845526736000",
    "pt_plan": "null",
    "pt_status": false,
    "sub_date": "14/01/2025",
    "sub_plan": "Monthly",
    "sub_type": "Couples",
    "time_stamp": "2025-01-14 10:05:27.971"
  },
  {
    "id": "-OGZ2xgsu9oionBBH-ZD",
    "amount": 19000,
    "boxing": false,
    "client_key": "AQxQHTLEEFQ8JvEAo8yE",
    "exp_date": "14/02/2025",
    "extras_amount": 0,
    "hist_type": "Renewal",
    "history_id": "49111736845549030000",
    "pt_plan": "null",
    "pt_status": false,
    "sub_date": "14/01/2025",
    "sub_plan": "Monthly",
    "sub_type": "Couples",
    "time_stamp": "2025-01-14 10:05:49.398"
  },
  {
    "id": "-OGZaZiWL9CsuVUpcycj",
    "amount": 20000,
    "boxing": false,
    "client_key": "I18HLZuH1msxMvbOdZRq",
    "exp_date": "14/02/2025",
    "extras_amount": 0,
    "hist_type": "Renewal",
    "history_id": "86841736854620399000",
    "pt_plan": "null",
    "pt_status": false,
    "sub_date": "14/01/2025",
    "sub_plan": "Monthly",
    "sub_type": "Individual",
    "time_stamp": "2025-01-14 12:37:01.146"
  },
  {
    "id": "-OG_So3DUglIUM_j3UA6",
    "amount": 20000,
    "boxing": false,
    "client_key": "PD2t2sNoGQjF0mKY74kz",
    "exp_date": "14/02/2025",
    "extras_amount": 0,
    "hist_type": "Renewal",
    "history_id": "51911736869100060000",
    "pt_plan": "null",
    "pt_status": false,
    "sub_date": "14/01/2025",
    "sub_plan": "Monthly",
    "sub_type": "Individual",
    "time_stamp": "2025-01-14 16:38:21.769"
  },
  {
    "id": "-OG_dH1JZxw1atH9Gtum",
    "amount": 8000,
    "boxing": false,
    "client_key": "gS96rK334cYXqBD2ftFM",
    "exp_date": "21/01/2025",
    "extras_amount": 0,
    "hist_type": "Renewal",
    "history_id": "21921736872107740000",
    "pt_plan": "null",
    "pt_status": false,
    "sub_date": "14/01/2025",
    "sub_plan": "Weekly",
    "sub_type": "Individual",
    "time_stamp": "2025-01-14 17:28:28.098"
  },
  {
    "id": "-OG_z6-zWZ9Js1S9UuLU",
    "amount": 20000,
    "boxing": false,
    "client_key": "41ZM39betjMwy45hqece",
    "exp_date": "14/02/2025",
    "extras_amount": 0,
    "hist_type": "Renewal",
    "history_id": "35911736877828913000",
    "pt_plan": "null",
    "pt_status": false,
    "sub_date": "14/01/2025",
    "sub_plan": "Monthly",
    "sub_type": "Individual",
    "time_stamp": "2025-01-14 19:03:50.164"
  },
  {
    "id": "-OGd31kZjzShHxNCX-3e",
    "amount": 70000,
    "boxing": false,
    "client_key": "2ZKNq7QipYHuE5xhBnCZ",
    "exp_date": "15/04/2025",
    "extras_amount": 15000,
    "hist_type": "Renewal",
    "history_id": "75401736929454705000",
    "pt_plan": "Standard",
    "pt_status": true,
    "sub_date": "15/01/2025",
    "sub_plan": "Quarterly",
    "sub_type": "Individual",
    "time_stamp": "2025-01-15 09:24:18.030"
  },
  {
    "id": "-OGd6Bca5dgOAoeq2TGU",
    "amount": 20000,
    "boxing": false,
    "client_key": "OJTpRxeKZ7qCDlKAASW1",
    "exp_date": "15/02/2025",
    "extras_amount": 0,
    "hist_type": "Renewal",
    "history_id": "37141736930282643000",
    "pt_plan": "null",
    "pt_status": false,
    "sub_date": "15/01/2025",
    "sub_plan": "Monthly",
    "sub_type": "Individual",
    "time_stamp": "2025-01-15 09:38:04.912"
  },
  {
    "id": "-OGd787PLJ0szBAwa0H4",
    "amount": 3000,
    "boxing": false,
    "client_key": "skgu74tpFSKE4eWEIQUs",
    "exp_date": "16/01/2025",
    "extras_amount": 0,
    "hist_type": "Registration",
    "history_id": "76201736930531410000",
    "pt_plan": "null",
    "pt_status": false,
    "sub_date": "15/01/2025",
    "sub_plan": "Daily",
    "sub_type": "Individual",
    "time_stamp": "2025-01-15 09:42:12.710"
  },
  {
    "id": "-OGd8eiTc1F-9jeXOdLn",
    "amount": 20000,
    "boxing": false,
    "client_key": "yAePm8GXSprHmbqKj0ZM",
    "exp_date": "15/02/2025",
    "extras_amount": 0,
    "hist_type": "Renewal",
    "history_id": "61541736930930469000",
    "pt_plan": "null",
    "pt_status": false,
    "sub_date": "15/01/2025",
    "sub_plan": "Monthly",
    "sub_type": "Individual",
    "time_stamp": "2025-01-15 09:48:52.459"
  },
  {
    "id": "-OGd9cNQA1gAhXkYj4_k",
    "amount": 15000,
    "boxing": false,
    "client_key": "QbTjQxvLYXTsrmb98xr7",
    "exp_date": "15/02/2025",
    "extras_amount": 0,
    "hist_type": "Renewal",
    "history_id": "90931736931183619000",
    "pt_plan": "null",
    "pt_status": false,
    "sub_amount_b4_discount": 20000,
    "sub_date": "15/01/2025",
    "sub_plan": "Monthly",
    "sub_type": "Individual",
    "time_stamp": "2025-01-15 09:53:05.000"
  },
  {
    "id": "-OGdAL38jiJRMA0xSF32",
    "amount": 20000,
    "boxing": false,
    "client_key": "yTVCDTTbZPIOtCu5GkK6",
    "exp_date": "15/02/2025",
    "extras_amount": 0,
    "hist_type": "Renewal",
    "history_id": "30461736931370785000",
    "pt_plan": "null",
    "pt_status": false,
    "sub_date": "15/01/2025",
    "sub_plan": "Monthly",
    "sub_type": "Individual",
    "time_stamp": "2025-01-15 09:56:12.117"
  },
  {
    "id": "-OGdAbFyHmfjMF0SgIk_",
    "amount": 13000,
    "boxing": false,
    "client_key": "YvYNQbW8RTJuzMSyGFF6",
    "exp_date": "22/01/2025",
    "extras_amount": 0,
    "hist_type": "Registration",
    "history_id": "47091736931441424000",
    "pt_plan": "null",
    "pt_status": false,
    "sub_date": "15/01/2025",
    "sub_plan": "Weekly",
    "sub_type": "Individual",
    "time_stamp": "2025-01-15 09:57:22.569"
  },
  {
    "id": "-OGdRJFf8B5Xg4wRjHwz",
    "amount": 8000,
    "boxing": false,
    "client_key": "KSHlPLZDVhfAXqoMbyCp",
    "exp_date": "22/01/2025",
    "extras_amount": 0,
    "hist_type": "Renewal",
    "history_id": "96191736935822979000",
    "pt_plan": "null",
    "pt_status": false,
    "sub_date": "15/01/2025",
    "sub_plan": "Weekly",
    "sub_type": "Individual",
    "time_stamp": "2025-01-15 11:10:24.294"
  },
  {
    "id": "-OGdwTW70T-1V3-upDLt",
    "amount": 25000,
    "boxing": false,
    "client_key": "7gFbPxCfYoD8dfOzdGjh",
    "exp_date": "15/02/2025",
    "extras_amount": 0,
    "hist_type": "Registration",
    "history_id": "13351736944224351000",
    "pt_plan": "null",
    "pt_status": false,
    "sub_date": "15/01/2025",
    "sub_plan": "Monthly",
    "sub_type": "Individual",
    "time_stamp": "2025-01-15 13:30:49.150"
  },
  {
    "id": "-OGf9RwX_NeVS5n6QIAL",
    "amount": 20000,
    "boxing": false,
    "client_key": "0RAYfrsBHihVxMU8YlAv",
    "exp_date": "15/02/2025",
    "extras_amount": 0,
    "hist_type": "Renewal",
    "history_id": "50851736964688683000",
    "pt_plan": "null",
    "pt_status": false,
    "sub_date": "15/01/2025",
    "sub_plan": "Monthly",
    "sub_type": "Individual",
    "time_stamp": "2025-01-15 19:11:30.256"
  },
  {
    "id": "-OGfEntBfEuvVcSS8LSG",
    "amount": 25000,
    "boxing": false,
    "client_key": "gjzMhloyIDqHfjnR1yld",
    "exp_date": "15/02/2025",
    "extras_amount": 0,
    "hist_type": "Registration",
    "history_id": "64611736966096293000",
    "pt_plan": "null",
    "pt_status": false,
    "sub_date": "15/01/2025",
    "sub_plan": "Monthly",
    "sub_type": "Individual",
    "time_stamp": "2025-01-15 19:34:57.909"
  },
  {
    "id": "-OGnIivy-NVsO_veVXph",
    "amount": 3000,
    "boxing": false,
    "client_key": "XuB63xm5eJ38geFEkON1",
    "exp_date": "18/01/2025",
    "extras_amount": 0,
    "hist_type": "Registration",
    "history_id": "12211737101342192000",
    "pt_plan": "null",
    "pt_status": false,
    "sub_date": "17/01/2025",
    "sub_plan": "Daily",
    "sub_type": "Individual",
    "time_stamp": "2025-01-17 09:09:02.973"
  },
  {
    "id": "-OGnKGe9zRNPfjvq1tzC",
    "amount": 55000,
    "boxing": false,
    "client_key": "u5nnjEwiHRxr62GgMC8E",
    "exp_date": "17/02/2025",
    "extras_amount": 30000,
    "hist_type": "Registration",
    "history_id": "55811737101744189000",
    "pt_plan": "Premium",
    "pt_status": true,
    "sub_date": "17/01/2025",
    "sub_plan": "Monthly",
    "sub_type": "Individual",
    "time_stamp": "2025-01-17 09:15:47.340"
  },
  {
    "id": "-OGnOIfx2tQw-ZuvnU9j",
    "amount": 3000,
    "boxing": false,
    "client_key": "DsspYAsiAtkqYrNkvfJO",
    "exp_date": "18/01/2025",
    "extras_amount": 0,
    "hist_type": "Renewal",
    "history_id": "88111737102801592000",
    "pt_plan": "null",
    "pt_status": false,
    "sub_date": "17/01/2025",
    "sub_plan": "Daily",
    "sub_type": "Individual",
    "time_stamp": "2025-01-17 09:33:23.205"
  },
  {
    "id": "-OGsQNtDw4zWwpBkI1gY",
    "amount": 19000,
    "boxing": false,
    "client_key": "sYan3b2MBqOQVIv52Lpa",
    "exp_date": "18/02/2025",
    "extras_amount": 0,
    "hist_type": "Renewal",
    "history_id": "83831737187212489000",
    "pt_plan": "null",
    "pt_status": false,
    "sub_date": "18/01/2025",
    "sub_plan": "Monthly",
    "sub_type": "Couples",
    "time_stamp": "2025-01-18 09:00:35.726"
  },
  {
    "id": "-OGsQfRa-6y4F0gWxakd",
    "amount": 19000,
    "boxing": false,
    "client_key": "PrU8IJui6iKhLsaNarj5",
    "exp_date": "18/02/2025",
    "extras_amount": 0,
    "hist_type": "Renewal",
    "history_id": "89111737187307089000",
    "pt_plan": "null",
    "pt_status": false,
    "sub_date": "18/01/2025",
    "sub_plan": "Monthly",
    "sub_type": "Couples",
    "time_stamp": "2025-01-18 09:01:51.722"
  },
  {
    "id": "-OGsRRRs5e3a2nIu_gWK",
    "amount": 25000,
    "boxing": false,
    "client_key": "x14rz67bxu0Cf3by87gH",
    "exp_date": "18/02/2025",
    "extras_amount": 0,
    "hist_type": "Registration",
    "history_id": "29081737187511018000",
    "pt_plan": "null",
    "pt_status": false,
    "sub_date": "18/01/2025",
    "sub_plan": "Monthly",
    "sub_type": "Individual",
    "time_stamp": "2025-01-18 09:05:12.444"
  },
  {
    "id": "-OGsYFyI043S40NRcbDw",
    "amount": 25000,
    "boxing": false,
    "client_key": "cYmORo6fGsEfrg0pe9ha",
    "exp_date": "18/02/2025",
    "extras_amount": 0,
    "hist_type": "Registration",
    "history_id": "67781737189297539000",
    "pt_plan": "null",
    "pt_status": false,
    "sub_date": "18/01/2025",
    "sub_plan": "Monthly",
    "sub_type": "Individual",
    "time_stamp": "2025-01-18 09:34:58.071"
  },
  {
    "id": "-OGsYJ6PTYtyzVnWRbzG",
    "amount": 0,
    "boxing": false,
    "client_key": "cYmORo6fGsEfrg0pe9ha",
    "exp_date": "18/02/2025",
    "extras_amount": 0,
    "hist_type": "Subscription Paused",
    "history_id": "22921737189310944000",
    "pt_plan": "",
    "pt_status": false,
    "sub_date": "18/01/2025",
    "sub_plan": "Monthly",
    "sub_type": "Individual",
    "time_stamp": "2025-01-18 09:35:10.945"
  },
  {
    "id": "-OGscl9Hso3uHpuhNTo5",
    "amount": 20000,
    "boxing": false,
    "client_key": "wJGTWviTvXeEZyfW6Et7",
    "exp_date": "18/02/2025",
    "extras_amount": 0,
    "hist_type": "Renewal",
    "history_id": "69981737190737973000",
    "pt_plan": "null",
    "pt_status": false,
    "sub_date": "18/01/2025",
    "sub_plan": "Monthly",
    "sub_type": "Individual",
    "time_stamp": "2025-01-18 09:59:00.659"
  },
  {
    "id": "-OH1llv_V8zL0J20cD2k",
    "amount": 3000,
    "boxing": false,
    "client_key": "F5E5EY7UXuY03ffAsOmc",
    "exp_date": "21/01/2025",
    "extras_amount": 0,
    "hist_type": "Registration",
    "history_id": "99801737360876756000",
    "pt_plan": "null",
    "pt_status": false,
    "sub_date": "20/01/2025",
    "sub_plan": "Daily",
    "sub_type": "Individual",
    "time_stamp": "2025-01-20 09:14:37.113"
  },
  {
    "id": "-OH1m49PnCz1CF61sBrd",
    "amount": 20000,
    "boxing": false,
    "client_key": "g1XEFzerkuKCUpxRB2wg",
    "exp_date": "20/02/2025",
    "extras_amount": 0,
    "hist_type": "Renewal",
    "history_id": "07821737360954456000",
    "pt_plan": "null",
    "pt_status": false,
    "sub_date": "20/01/2025",
    "sub_plan": "Monthly",
    "sub_type": "Individual",
    "time_stamp": "2025-01-20 09:15:55.885"
  },
  {
    "id": "-OH1mMY7Fy91xw2p0C3k",
    "amount": 20000,
    "boxing": false,
    "client_key": "nx7RBoZckdajdB9mSpTS",
    "exp_date": "20/02/2025",
    "extras_amount": 0,
    "hist_type": "Renewal",
    "history_id": "34911737361030080000",
    "pt_plan": "null",
    "pt_status": false,
    "sub_date": "20/01/2025",
    "sub_plan": "Monthly",
    "sub_type": "Individual",
    "time_stamp": "2025-01-20 09:17:11.197"
  },
  {
    "id": "-OH1sYwtYn1BI-y_2Ztq",
    "amount": 13000,
    "boxing": false,
    "client_key": "k2Cx3tnj42Lm2uJdBFrq",
    "exp_date": "27/01/2025",
    "extras_amount": 0,
    "hist_type": "Registration",
    "history_id": "93801737362654513000",
    "pt_plan": "null",
    "pt_status": false,
    "sub_date": "20/01/2025",
    "sub_plan": "Weekly",
    "sub_type": "Individual",
    "time_stamp": "2025-01-20 09:44:14.906"
  },
  {
    "id": "-OH6vy7Nmco7ajRPGywS",
    "amount": 12500,
    "boxing": false,
    "client_key": "AE4bFij5DQDcfgdyukqg",
    "exp_date": "28/01/2025",
    "extras_amount": 0,
    "hist_type": "Registration",
    "history_id": "03071737447432504000",
    "pt_plan": "null",
    "pt_status": false,
    "sub_date": "21/01/2025",
    "sub_plan": "Weekly",
    "sub_type": "Couples",
    "time_stamp": "2025-01-21 09:17:12.847"
  },
  {
    "id": "-OH6w-raGjmkpVTs4EyP",
    "amount": 0,
    "boxing": false,
    "client_key": "AE4bFij5DQDcfgdyukqg",
    "exp_date": "28/01/2025",
    "extras_amount": 0,
    "hist_type": "Subscription Paused",
    "history_id": "10901737447444066000",
    "pt_plan": "",
    "pt_status": false,
    "sub_date": "21/01/2025",
    "sub_plan": "Weekly",
    "sub_type": "Couples",
    "time_stamp": "2025-01-21 09:17:24.066"
  },
  {
    "id": "-OH6wMTUwwebSF1x_fo0",
    "amount": 12500,
    "boxing": false,
    "client_key": "cfAa4yhEEkfV6rSPdMOb",
    "exp_date": "28/01/2025",
    "extras_amount": 0,
    "hist_type": "Registration",
    "history_id": "84521737447536287000",
    "pt_plan": "null",
    "pt_status": false,
    "sub_date": "21/01/2025",
    "sub_plan": "Weekly",
    "sub_type": "Couples",
    "time_stamp": "2025-01-21 09:18:56.666"
  },
  {
    "id": "-OH6wPWN_dlhMB4r9rlB",
    "amount": 0,
    "boxing": false,
    "client_key": "cfAa4yhEEkfV6rSPdMOb",
    "exp_date": "28/01/2025",
    "extras_amount": 0,
    "hist_type": "Subscription Paused",
    "history_id": "47551737447549139000",
    "pt_plan": "",
    "pt_status": false,
    "sub_date": "21/01/2025",
    "sub_plan": "Weekly",
    "sub_type": "Couples",
    "time_stamp": "2025-01-21 09:19:09.140"
  },
  {
    "id": "-OH6wkpd4Lo1D3y0R_bH",
    "amount": 3000,
    "boxing": false,
    "client_key": "QZpA7rOQ6xNhRJHPJU7n",
    "exp_date": "22/01/2025",
    "extras_amount": 0,
    "hist_type": "Registration",
    "history_id": "08521737447640167000",
    "pt_plan": "null",
    "pt_status": false,
    "sub_date": "21/01/2025",
    "sub_plan": "Daily",
    "sub_type": "Individual",
    "time_stamp": "2025-01-21 09:20:40.549"
  },
  {
    "id": "-OH75pXvpQETqPZvXiAq",
    "amount": 40000,
    "boxing": false,
    "client_key": "K7CNbB27TTP2s3FRvMdN",
    "exp_date": "21/02/2025",
    "extras_amount": 15000,
    "hist_type": "Registration",
    "history_id": "33431737450280845000",
    "pt_plan": "Standard",
    "pt_status": true,
    "sub_date": "21/01/2025",
    "sub_plan": "Monthly",
    "sub_type": "Individual",
    "time_stamp": "2025-01-21 10:04:41.220"
  },
  {
    "id": "-OH7CUkMJDyP4A8NIHAl",
    "amount": 20000,
    "boxing": false,
    "client_key": "BFk7wCVvINCBhX2qcyjB",
    "exp_date": "21/02/2025",
    "extras_amount": 0,
    "hist_type": "Renewal",
    "history_id": "93081737452026643000",
    "pt_plan": "null",
    "pt_status": false,
    "sub_date": "21/01/2025",
    "sub_plan": "Monthly",
    "sub_type": "Individual",
    "time_stamp": "2025-01-21 10:33:46.974"
  },
  {
    "id": "-OH7ESA4WQ-xQ32t8Ohc",
    "amount": 25000,
    "boxing": false,
    "client_key": "02GUHGXkUqzsGuyOSDyg",
    "exp_date": "21/02/2025",
    "extras_amount": 0,
    "hist_type": "Registration",
    "history_id": "77991737452540153000",
    "pt_plan": "null",
    "pt_status": false,
    "sub_date": "21/01/2025",
    "sub_plan": "Monthly",
    "sub_type": "Individual",
    "time_stamp": "2025-01-21 10:42:20.686"
  },
  {
    "id": "-OH7ETjtxqQrZwR1mvLw",
    "amount": 0,
    "boxing": false,
    "client_key": "02GUHGXkUqzsGuyOSDyg",
    "exp_date": "21/02/2025",
    "extras_amount": 0,
    "hist_type": "Subscription Paused",
    "history_id": "72041737452547140000",
    "pt_plan": "",
    "pt_status": false,
    "sub_date": "21/01/2025",
    "sub_plan": "Monthly",
    "sub_type": "Individual",
    "time_stamp": "2025-01-21 10:42:27.140"
  },
  {
    "id": "-OH7N8AfvQHu_AxqL-m3",
    "amount": 15000,
    "boxing": false,
    "client_key": "O1tFCA4lf8NXb7eXJ1nX",
    "exp_date": "21/02/2025",
    "extras_amount": 0,
    "hist_type": "Renewal",
    "history_id": "61591737454816823000",
    "pt_plan": "null",
    "pt_status": false,
    "sub_amount_b4_discount": 20000,
    "sub_date": "21/01/2025",
    "sub_plan": "Monthly",
    "sub_type": "Individual",
    "time_stamp": "2025-01-21 11:20:18.100"
  },
  {
    "id": "-OH7NcynRtI9yFezb7kA",
    "amount": 20000,
    "boxing": false,
    "client_key": "FYSculjWDNODA141SvD1",
    "exp_date": "21/02/2025",
    "extras_amount": 0,
    "hist_type": "Renewal",
    "history_id": "56041737454947233000",
    "pt_plan": "null",
    "pt_status": false,
    "sub_date": "21/01/2025",
    "sub_plan": "Monthly",
    "sub_type": "Individual",
    "time_stamp": "2025-01-21 11:22:28.348"
  },
  {
    "id": "-OH7TA5PK_W1uog8i87o",
    "amount": 20000,
    "boxing": false,
    "client_key": "6juoVyzZewskF6v9lQhz",
    "exp_date": "21/02/2025",
    "extras_amount": 0,
    "hist_type": "Renewal",
    "history_id": "10121737456398455000",
    "pt_plan": "null",
    "pt_status": false,
    "sub_date": "21/01/2025",
    "sub_plan": "Monthly",
    "sub_type": "Individual",
    "time_stamp": "2025-01-21 11:46:38.818"
  },
  {
    "id": "-OH93z0YVql7vkbASXL9",
    "amount": 25000,
    "boxing": false,
    "client_key": "XOQImKQ1d34a0izmkI0R",
    "exp_date": "21/02/2025",
    "extras_amount": 0,
    "hist_type": "Registration",
    "history_id": "14401737483350400000",
    "pt_plan": "null",
    "pt_status": false,
    "sub_date": "21/01/2025",
    "sub_plan": "Monthly",
    "sub_type": "Individual",
    "time_stamp": "2025-01-21 19:15:50.762"
  },
  {
    "id": "-OH941EisRAu55KvGOKw",
    "amount": 0,
    "boxing": false,
    "client_key": "XOQImKQ1d34a0izmkI0R",
    "exp_date": "21/02/2025",
    "extras_amount": 0,
    "hist_type": "Subscription Paused",
    "history_id": "67331737483363957000",
    "pt_plan": "",
    "pt_status": false,
    "sub_date": "21/01/2025",
    "sub_plan": "Monthly",
    "sub_type": "Individual",
    "time_stamp": "2025-01-21 19:16:03.957"
  },
  {
    "id": "-OH94GEAkE9CPAdTeZ70",
    "amount": 25000,
    "boxing": false,
    "client_key": "uRCbFVGvndnbpUKHAkDM",
    "exp_date": "21/02/2025",
    "extras_amount": 0,
    "hist_type": "Registration",
    "history_id": "04151737483425002000",
    "pt_plan": "null",
    "pt_status": false,
    "sub_date": "21/01/2025",
    "sub_plan": "Monthly",
    "sub_type": "Individual",
    "time_stamp": "2025-01-21 19:17:05.360"
  },
  {
    "id": "-OH94IFyGOUW2WwsEDq0",
    "amount": 0,
    "boxing": false,
    "client_key": "uRCbFVGvndnbpUKHAkDM",
    "exp_date": "21/02/2025",
    "extras_amount": 0,
    "hist_type": "Subscription Paused",
    "history_id": "78431737483433669000",
    "pt_plan": "",
    "pt_status": false,
    "sub_date": "21/01/2025",
    "sub_plan": "Monthly",
    "sub_type": "Individual",
    "time_stamp": "2025-01-21 19:17:13.669"
  },
  {
    "id": "-OH94_9UNMKX4PUtOth8",
    "amount": 20000,
    "boxing": false,
    "client_key": "ygv9zI5zvklXOSneSI8L",
    "exp_date": "21/02/2025",
    "extras_amount": 0,
    "hist_type": "Renewal",
    "history_id": "59091737483505769000",
    "pt_plan": "null",
    "pt_status": false,
    "sub_date": "21/01/2025",
    "sub_plan": "Monthly",
    "sub_type": "Individual",
    "time_stamp": "2025-01-21 19:18:26.981"
  },
  {
    "id": "-OHBxArU4qxXDwZIsIQ5",
    "amount": 0,
    "boxing": false,
    "client_key": "cRI1UYaVfSa6HXeYBy4Y",
    "exp_date": "22/02/2025",
    "extras_amount": 0,
    "hist_type": "Subscription Resumed",
    "history_id": "41901737531639192000",
    "pt_plan": "",
    "pt_status": false,
    "sub_date": "22/01/2025",
    "sub_plan": "Monthly",
    "sub_type": "Individual",
    "time_stamp": "2025-01-22 08:40:39.192"
  },
  {
    "id": "-OHBxK-JIN5cnMCRMivZ",
    "amount": 3000,
    "boxing": false,
    "client_key": "skgu74tpFSKE4eWEIQUs",
    "exp_date": "23/01/2025",
    "extras_amount": 0,
    "hist_type": "Renewal",
    "history_id": "75661737531676294000",
    "pt_plan": "null",
    "pt_status": false,
    "sub_date": "22/01/2025",
    "sub_plan": "Daily",
    "sub_type": "Individual",
    "time_stamp": "2025-01-22 08:41:16.624"
  },
  {
    "id": "-OHByE0xBjOKwVZqDS9F",
    "amount": 13000,
    "boxing": false,
    "client_key": "WJnXFT8rl4NQmC23g1z0",
    "exp_date": "29/01/2025",
    "extras_amount": 0,
    "hist_type": "Registration",
    "history_id": "40581737531912686000",
    "pt_plan": "null",
    "pt_status": false,
    "sub_date": "22/01/2025",
    "sub_plan": "Weekly",
    "sub_type": "Individual",
    "time_stamp": "2025-01-22 08:45:13.174"
  },
  {
    "id": "-OHC-EgHRYh2o-S5p-Co",
    "amount": 20000,
    "boxing": false,
    "client_key": "I4GULv3MAawD5Z6g6V5S",
    "exp_date": "22/02/2025",
    "extras_amount": 0,
    "hist_type": "Renewal",
    "history_id": "29871737532438984000",
    "pt_plan": "null",
    "pt_status": false,
    "sub_date": "22/01/2025",
    "sub_plan": "Monthly",
    "sub_type": "Individual",
    "time_stamp": "2025-01-22 08:54:00.173"
  },
  {
    "id": "-OHCTxEUI-oKdKkeE1kI",
    "amount": 20000,
    "boxing": false,
    "client_key": "uvlBFYKKvyKpx38aci1z",
    "exp_date": "22/02/2025",
    "extras_amount": 0,
    "hist_type": "Renewal",
    "history_id": "55331737540489662000",
    "pt_plan": "null",
    "pt_status": false,
    "sub_date": "22/01/2025",
    "sub_plan": "Monthly",
    "sub_type": "Individual",
    "time_stamp": "2025-01-22 11:08:10.840"
  },
  {
    "id": "-OHHD4kfVkR6SSSAJEYw",
    "amount": 0,
    "boxing": false,
    "client_key": "AE4bFij5DQDcfgdyukqg",
    "exp_date": "30/01/2025",
    "extras_amount": 0,
    "hist_type": "Subscription Resumed",
    "history_id": "33421737619955993000",
    "pt_plan": "",
    "pt_status": false,
    "sub_date": "23/01/2025",
    "sub_plan": "Weekly",
    "sub_type": "Couples",
    "time_stamp": "2025-01-23 09:12:35.994"
  },
  {
    "id": "-OHHD6lNkcSpfLKAtEj2",
    "amount": 0,
    "boxing": false,
    "client_key": "cfAa4yhEEkfV6rSPdMOb",
    "exp_date": "30/01/2025",
    "extras_amount": 0,
    "hist_type": "Subscription Resumed",
    "history_id": "57591737619964237000",
    "pt_plan": "",
    "pt_status": false,
    "sub_date": "23/01/2025",
    "sub_plan": "Weekly",
    "sub_type": "Couples",
    "time_stamp": "2025-01-23 09:12:44.237"
  },
  {
    "id": "-OHI5efzb6P7uSedoULP",
    "amount": 25000,
    "boxing": false,
    "client_key": "scFVGzIeeBapUd3wmlCu",
    "exp_date": "23/02/2025",
    "extras_amount": 0,
    "hist_type": "Registration",
    "history_id": "72401737634786406000",
    "pt_plan": "null",
    "pt_status": false,
    "sub_date": "23/01/2025",
    "sub_plan": "Monthly",
    "sub_type": "Individual",
    "time_stamp": "2025-01-23 13:19:46.921"
  },
  {
    "id": "-OHI5h1qY-Xej1fy7U6Q",
    "amount": 0,
    "boxing": false,
    "client_key": "scFVGzIeeBapUd3wmlCu",
    "exp_date": "23/02/2025",
    "extras_amount": 0,
    "hist_type": "Subscription Paused",
    "history_id": "03601737634796582000",
    "pt_plan": "",
    "pt_status": false,
    "sub_date": "23/01/2025",
    "sub_plan": "Monthly",
    "sub_type": "Individual",
    "time_stamp": "2025-01-23 13:19:56.582"
  },
  {
    "id": "-OHI5slR_7KuVcSNl5V1",
    "amount": 15000,
    "boxing": false,
    "client_key": "scFVGzIeeBapUd3wmlCu",
    "exp_date": "23/02/2025",
    "extras_amount": 0,
    "hist_type": "Personal Training",
    "history_id": "10121737634844648000",
    "pt_plan": "",
    "pt_status": false,
    "sub_date": "23/01/2025",
    "sub_plan": "Standard Plan",
    "sub_type": "",
    "time_stamp": "2025-01-23 13:20:44.648"
  },
  {
    "id": "-OHI7E_CF7M2elcQWscG",
    "amount": 25000,
    "boxing": false,
    "client_key": "ib5gp46ZfUBYN436tg8D",
    "exp_date": "23/02/2025",
    "extras_amount": 0,
    "hist_type": "Registration",
    "history_id": "58301737635199614000",
    "pt_plan": "null",
    "pt_status": false,
    "sub_date": "23/01/2025",
    "sub_plan": "Monthly",
    "sub_type": "Individual",
    "time_stamp": "2025-01-23 13:26:40.217"
  },
  {
    "id": "-OHI7HVMpDJoLdfDzMG_",
    "amount": 0,
    "boxing": false,
    "client_key": "ib5gp46ZfUBYN436tg8D",
    "exp_date": "23/02/2025",
    "extras_amount": 0,
    "hist_type": "Subscription Paused",
    "history_id": "52191737635212197000",
    "pt_plan": "",
    "pt_status": false,
    "sub_date": "23/01/2025",
    "sub_plan": "Monthly",
    "sub_type": "Individual",
    "time_stamp": "2025-01-23 13:26:52.197"
  },
  {
    "id": "-OHIVHah0ko7TNXlAqF2",
    "amount": 25000,
    "boxing": false,
    "client_key": "mUPEIiDfn1WgQrnuZFYx",
    "exp_date": "23/02/2025",
    "extras_amount": 0,
    "hist_type": "Registration",
    "history_id": "37001737641503670000",
    "pt_plan": "null",
    "pt_status": false,
    "sub_date": "23/01/2025",
    "sub_plan": "Monthly",
    "sub_type": "Individual",
    "time_stamp": "2025-01-23 15:11:44.036"
  },
  {
    "id": "-OHMT4-ZJ2VaSzGSEhi_",
    "amount": 20000,
    "boxing": false,
    "client_key": "IhLmhZeTQge3653ychxK",
    "exp_date": "24/02/2025",
    "extras_amount": 0,
    "hist_type": "Renewal",
    "history_id": "93751737708032788000",
    "pt_plan": "null",
    "pt_status": false,
    "sub_date": "24/01/2025",
    "sub_plan": "Monthly",
    "sub_type": "Individual",
    "time_stamp": "2025-01-24 09:40:34.068"
  },
  {
    "id": "-OHMYOSEHOMjNCMHfG1K",
    "amount": 0,
    "boxing": false,
    "client_key": "uRCbFVGvndnbpUKHAkDM",
    "exp_date": "24/02/2025",
    "extras_amount": 0,
    "hist_type": "Subscription Resumed",
    "history_id": "29851737709428690000",
    "pt_plan": "",
    "pt_status": false,
    "sub_date": "24/01/2025",
    "sub_plan": "Monthly",
    "sub_type": "Individual",
    "time_stamp": "2025-01-24 10:03:48.690"
  },
  {
    "id": "-OHMY_V-VCpv0C-DUHsi",
    "amount": 0,
    "boxing": false,
    "client_key": "XOQImKQ1d34a0izmkI0R",
    "exp_date": "24/02/2025",
    "extras_amount": 0,
    "hist_type": "Subscription Resumed",
    "history_id": "24431737709478022000",
    "pt_plan": "",
    "pt_status": false,
    "sub_date": "24/01/2025",
    "sub_plan": "Monthly",
    "sub_type": "Individual",
    "time_stamp": "2025-01-24 10:04:38.023"
  },
  {
    "id": "-OHMZ90MVAbK6OGAJVpE",
    "amount": 0,
    "boxing": false,
    "client_key": "PldsRRPGkV1NM7ooPW92",
    "exp_date": "24/02/2025",
    "extras_amount": 0,
    "hist_type": "Renewal",
    "history_id": "46301737709627184000",
    "pt_plan": "null",
    "pt_status": false,
    "sub_date": "24/01/2025",
    "sub_plan": "HMO Plan",
    "sub_type": "HMO Plan",
    "time_stamp": "2025-01-24 10:07:07.615"
  },
  {
    "id": "-OHMZCXTtFJm5hU4jR7g",
    "amount": 15000,
    "boxing": false,
    "client_key": "PldsRRPGkV1NM7ooPW92",
    "exp_date": "24/02/2025",
    "extras_amount": 0,
    "hist_type": "Personal Training",
    "history_id": "12571737709642022000",
    "pt_plan": "",
    "pt_status": false,
    "sub_date": "24/01/2025",
    "sub_plan": "Standard Plan",
    "sub_type": "",
    "time_stamp": "2025-01-24 10:07:22.022"
  },
  {
    "id": "-OHNMAwqq3e7PJn4PfLN",
    "amount": 0,
    "boxing": false,
    "client_key": "scFVGzIeeBapUd3wmlCu",
    "exp_date": "24/02/2025",
    "extras_amount": 0,
    "hist_type": "Subscription Resumed",
    "history_id": "72881737723002959000",
    "pt_plan": "",
    "pt_status": false,
    "sub_date": "24/01/2025",
    "sub_plan": "Monthly",
    "sub_type": "Individual",
    "time_stamp": "2025-01-24 13:50:02.959"
  },
  {
    "id": "-OHOMEEjPsN-r90pI9Q0",
    "amount": 20000,
    "boxing": false,
    "client_key": "Wzrria2CnsrPuRRnE3gu",
    "exp_date": "24/02/2025",
    "extras_amount": 0,
    "hist_type": "Renewal",
    "history_id": "82291737739792749000",
    "pt_plan": "null",
    "pt_status": false,
    "sub_date": "24/01/2025",
    "sub_plan": "Monthly",
    "sub_type": "Individual",
    "time_stamp": "2025-01-24 18:29:53.947"
  },
  {
    "id": "-OHOYZGsBr_tx6LcyTdi",
    "amount": 20000,
    "boxing": false,
    "client_key": "0sBZV8PLn9OG3xURhKoi",
    "exp_date": "24/02/2025",
    "extras_amount": 0,
    "hist_type": "Renewal",
    "history_id": "34431737743024524000",
    "pt_plan": "null",
    "pt_status": false,
    "sub_date": "24/01/2025",
    "sub_plan": "Monthly",
    "sub_type": "Individual",
    "time_stamp": "2025-01-24 19:23:45.690"
  },
  {
    "id": "-OHOZCzCLgiR6PENdJCU",
    "amount": 3000,
    "boxing": false,
    "client_key": "cL7KLKaxSi5GG8q4qG2T",
    "exp_date": "25/01/2025",
    "extras_amount": 0,
    "hist_type": "Registration",
    "history_id": "95601737743196159000",
    "pt_plan": "null",
    "pt_status": false,
    "sub_date": "24/01/2025",
    "sub_plan": "Daily",
    "sub_type": "Individual",
    "time_stamp": "2025-01-24 19:26:36.530"
  },
  {
    "id": "-OHOhSE7wQlgj8b79ekF",
    "amount": 3000,
    "boxing": false,
    "client_key": "DmguPAHcMqlxb3TCpNdH",
    "exp_date": "25/01/2025",
    "extras_amount": 0,
    "hist_type": "Registration",
    "history_id": "39021737745617919000",
    "pt_plan": "null",
    "pt_status": false,
    "sub_date": "24/01/2025",
    "sub_plan": "Daily",
    "sub_type": "Individual",
    "time_stamp": "2025-01-24 20:06:58.307"
  },
  {
    "id": "-OHRUZhSS_5EE3qNTNVH",
    "amount": 14000,
    "boxing": false,
    "client_key": "AIXlOm7n0cV5gAvf9vfB",
    "exp_date": "08/02/2025",
    "extras_amount": 0,
    "hist_type": "Renewal",
    "history_id": "38581737792310216000",
    "pt_plan": "null",
    "pt_status": false,
    "sub_date": "25/01/2025",
    "sub_plan": "Fortnightly",
    "sub_type": "Individual",
    "time_stamp": "2025-01-25 09:05:10.849"
  },
  {
    "id": "-OHRXQnqLziLBhoq8k11",
    "amount": 3000,
    "boxing": false,
    "client_key": "6BawlmDNM1BBVj0Mz2uY",
    "exp_date": "26/01/2025",
    "extras_amount": 0,
    "hist_type": "Renewal",
    "history_id": "97401737793060711000",
    "pt_plan": "null",
    "pt_status": false,
    "sub_date": "25/01/2025",
    "sub_plan": "Daily",
    "sub_type": "Individual",
    "time_stamp": "2025-01-25 09:17:41.078"
  },
  {
    "id": "-OHRXgLRHGS-wBSWN9m6",
    "amount": 2000,
    "boxing": false,
    "client_key": "DihCmRMzQYH28FCP8FBC",
    "exp_date": "26/01/2025",
    "extras_amount": 0,
    "hist_type": "Renewal",
    "history_id": "84911737793127559000",
    "pt_plan": "null",
    "pt_status": false,
    "sub_amount_b4_discount": 3000,
    "sub_date": "25/01/2025",
    "sub_plan": "Daily",
    "sub_type": "Individual",
    "time_stamp": "2025-01-25 09:18:48.830"
  },
  {
    "id": "-OHRfVC2hAjivh5F_aAU",
    "amount": 3000,
    "boxing": false,
    "client_key": "OxovtbndhAgGWZ4W6aVb",
    "exp_date": "26/01/2025",
    "extras_amount": 0,
    "hist_type": "Registration",
    "history_id": "27461737795438550000",
    "pt_plan": "null",
    "pt_status": false,
    "sub_date": "25/01/2025",
    "sub_plan": "Daily",
    "sub_type": "Individual",
    "time_stamp": "2025-01-25 09:57:18.887"
  },
  {
    "id": "-OHai0B5SVecRDAk500k",
    "amount": 0,
    "boxing": false,
    "client_key": "ib5gp46ZfUBYN436tg8D",
    "exp_date": "27/02/2025",
    "extras_amount": 0,
    "hist_type": "Subscription Resumed",
    "history_id": "44211737963870857000",
    "pt_plan": "",
    "pt_status": false,
    "sub_date": "27/01/2025",
    "sub_plan": "Monthly",
    "sub_type": "Individual",
    "time_stamp": "2025-01-27 08:44:30.857"
  },
  {
    "id": "-OHaidOQ8TLqdHeWfVs2",
    "amount": 0,
    "boxing": false,
    "client_key": "02GUHGXkUqzsGuyOSDyg",
    "exp_date": "27/02/2025",
    "extras_amount": 0,
    "hist_type": "Subscription Resumed",
    "history_id": "36971737964035553000",
    "pt_plan": "",
    "pt_status": false,
    "sub_date": "27/01/2025",
    "sub_plan": "Monthly",
    "sub_type": "Individual",
    "time_stamp": "2025-01-27 08:47:15.553"
  },
  {
    "id": "-OHajW0FHfwhnX2QMm3H",
    "amount": 15000,
    "boxing": false,
    "client_key": "ib5gp46ZfUBYN436tg8D",
    "exp_date": "27/02/2025",
    "extras_amount": 0,
    "hist_type": "Personal Training",
    "history_id": "41871737964263593000",
    "pt_plan": "",
    "pt_status": false,
    "sub_date": "27/01/2025",
    "sub_plan": "Standard Plan",
    "sub_type": "",
    "time_stamp": "2025-01-27 08:51:03.593"
  },
  {
    "id": "-OHalgNyS_rzaExITu-b",
    "amount": 20000,
    "boxing": false,
    "client_key": "7fGarDMsvYZprHer13Ak",
    "exp_date": "27/02/2025",
    "extras_amount": 0,
    "hist_type": "Renewal",
    "history_id": "66171737964832553000",
    "pt_plan": "null",
    "pt_status": false,
    "sub_date": "27/01/2025",
    "sub_plan": "Monthly",
    "sub_type": "Individual",
    "time_stamp": "2025-01-27 09:00:34.235"
  },
  {
    "id": "-OHaqltvKBSAmbb5S0XU",
    "amount": 20000,
    "boxing": false,
    "client_key": "idAtQUhgf39mtIEmz6pw",
    "exp_date": "27/02/2025",
    "extras_amount": 0,
    "hist_type": "Renewal",
    "history_id": "16551737966166351000",
    "pt_plan": "null",
    "pt_status": false,
    "sub_date": "27/01/2025",
    "sub_plan": "Monthly",
    "sub_type": "Individual",
    "time_stamp": "2025-01-27 09:22:47.564"
  },
  {
    "id": "-OHas7aQeVHgTDkqVeUl",
    "amount": 20000,
    "boxing": false,
    "client_key": "SNhMVRmAzLtkNo4z8ebu",
    "exp_date": "27/02/2025",
    "extras_amount": 0,
    "hist_type": "Renewal",
    "history_id": "82961737966522317000",
    "pt_plan": "null",
    "pt_status": false,
    "sub_date": "27/01/2025",
    "sub_plan": "Monthly",
    "sub_type": "Individual",
    "time_stamp": "2025-01-27 09:28:42.668"
  },
  {
    "id": "-OHbNmnPmN1KhW4iY3P-",
    "amount": 25000,
    "boxing": false,
    "client_key": "E58mlTk63MQklSgkw8Qu",
    "exp_date": "27/02/2025",
    "extras_amount": 0,
    "hist_type": "Registration",
    "history_id": "26191737975083911000",
    "pt_plan": "null",
    "pt_status": false,
    "sub_date": "27/01/2025",
    "sub_plan": "Monthly",
    "sub_type": "Individual",
    "time_stamp": "2025-01-27 11:51:24.215"
  },
  {
    "id": "-OHbNpiPWeFb8kUgMtxy",
    "amount": 0,
    "boxing": false,
    "client_key": "E58mlTk63MQklSgkw8Qu",
    "exp_date": "27/02/2025",
    "extras_amount": 0,
    "hist_type": "Subscription Paused",
    "history_id": "02481737975096186000",
    "pt_plan": "",
    "pt_status": false,
    "sub_date": "27/01/2025",
    "sub_plan": "Monthly",
    "sub_type": "Individual",
    "time_stamp": "2025-01-27 11:51:36.187"
  },
  {
    "id": "-OHbyRnzF6mCF7RMWMOn",
    "amount": 25000,
    "boxing": false,
    "client_key": "v83tbEExmduochl1L6Uu",
    "exp_date": "27/02/2025",
    "extras_amount": 0,
    "hist_type": "Registration",
    "history_id": "54911737984955348000",
    "pt_plan": "null",
    "pt_status": false,
    "sub_date": "27/01/2025",
    "sub_plan": "Monthly",
    "sub_type": "Individual",
    "time_stamp": "2025-01-27 14:35:55.703"
  },
  {
    "id": "-OHbyTkXkO2BJBlDiJFR",
    "amount": 0,
    "boxing": false,
    "client_key": "v83tbEExmduochl1L6Uu",
    "exp_date": "27/02/2025",
    "extras_amount": 0,
    "hist_type": "Subscription Paused",
    "history_id": "00031737984963677000",
    "pt_plan": "",
    "pt_status": false,
    "sub_date": "27/01/2025",
    "sub_plan": "Monthly",
    "sub_type": "Individual",
    "time_stamp": "2025-01-27 14:36:03.678"
  },
  {
    "id": "-OHcbjhmNIXmFfDFDNR1",
    "amount": 3000,
    "boxing": false,
    "client_key": "skgu74tpFSKE4eWEIQUs",
    "exp_date": "28/01/2025",
    "extras_amount": 0,
    "hist_type": "Renewal",
    "history_id": "95501737995779898000",
    "pt_plan": "null",
    "pt_status": false,
    "sub_date": "27/01/2025",
    "sub_plan": "Daily",
    "sub_type": "Individual",
    "time_stamp": "2025-01-27 17:36:21.078"
  },
  {
    "id": "-OHd0VGcxIx3JaPkPSiJ",
    "amount": 20000,
    "boxing": false,
    "client_key": "WqhbBAzU4oz3Bh4ftGKj",
    "exp_date": "16/02/2025",
    "extras_amount": 0,
    "hist_type": "Renewal",
    "history_id": "19791738002532682000",
    "pt_plan": "null",
    "pt_status": false,
    "sub_date": "27/01/2025",
    "sub_plan": "Monthly",
    "sub_type": "Individual",
    "time_stamp": "2025-01-27 19:28:53.779"
  },
  {
    "id": "-OHfzl5vtZAD4XmG8edH",
    "amount": 0,
    "boxing": false,
    "client_key": "v83tbEExmduochl1L6Uu",
    "exp_date": "28/02/2025",
    "extras_amount": 0,
    "hist_type": "Subscription Resumed",
    "history_id": "00991738052410417000",
    "pt_plan": "",
    "pt_status": false,
    "sub_date": "28/01/2025",
    "sub_plan": "Monthly",
    "sub_type": "Individual",
    "time_stamp": "2025-01-28 09:20:10.417"
  },
  {
    "id": "-OHg-ORE94Roiatsizn5",
    "amount": 20000,
    "boxing": false,
    "client_key": "VXncc5xcyHZuB8yGWVH1",
    "exp_date": "28/02/2025",
    "extras_amount": 0,
    "hist_type": "Renewal",
    "history_id": "83811738052574431000",
    "pt_plan": "null",
    "pt_status": false,
    "sub_date": "28/01/2025",
    "sub_plan": "Monthly",
    "sub_type": "Individual",
    "time_stamp": "2025-01-28 09:22:55.621"
  },
  {
    "id": "-OHg-axb_T10g-JjHZ2T",
    "amount": 20000,
    "boxing": false,
    "client_key": "VxpXmo1tSJvGJvcg0inX",
    "exp_date": "28/02/2025",
    "extras_amount": 0,
    "hist_type": "Renewal",
    "history_id": "43051738052630630000",
    "pt_plan": "null",
    "pt_status": false,
    "sub_date": "28/01/2025",
    "sub_plan": "Monthly",
    "sub_type": "Individual",
    "time_stamp": "2025-01-28 09:23:51.008"
  },
  {
    "id": "-OHg1fryUD11odlypMWA",
    "amount": 15000,
    "boxing": false,
    "client_key": "v83tbEExmduochl1L6Uu",
    "exp_date": "28/02/2025",
    "extras_amount": 0,
    "hist_type": "Personal Training",
    "history_id": "45971738053175411000",
    "pt_plan": "",
    "pt_status": false,
    "sub_date": "28/01/2025",
    "sub_plan": "Standard Plan",
    "sub_type": "",
    "time_stamp": "2025-01-28 09:32:55.411"
  },
  {
    "id": "-OHg2uP3-vJWFOAXwEyI",
    "amount": 20000,
    "boxing": false,
    "client_key": "Q2sE0fNqqaKIRbiLxwMu",
    "exp_date": "28/02/2025",
    "extras_amount": 0,
    "hist_type": "Renewal",
    "history_id": "56601738053496712000",
    "pt_plan": "null",
    "pt_status": false,
    "sub_date": "28/01/2025",
    "sub_plan": "Monthly",
    "sub_type": "Individual",
    "time_stamp": "2025-01-28 09:38:17.025"
  },
  {
    "id": "-OHg3RYoi7BLD-MDcgK8",
    "amount": 25000,
    "boxing": false,
    "client_key": "GlZFt6lpNTg7SAVC4v3L",
    "exp_date": "28/02/2025",
    "extras_amount": 0,
    "hist_type": "Registration",
    "history_id": "52131738053636559000",
    "pt_plan": "null",
    "pt_status": false,
    "sub_date": "28/01/2025",
    "sub_plan": "Monthly",
    "sub_type": "Individual",
    "time_stamp": "2025-01-28 09:40:36.911"
  },
  {
    "id": "-OHgLQoknyK-H8GT2B2n",
    "amount": 40000,
    "boxing": false,
    "client_key": "5j6NGzGRLq5WkY9ipOi7",
    "exp_date": "28/02/2025",
    "extras_amount": 15000,
    "hist_type": "Registration",
    "history_id": "87031738058352097000",
    "pt_plan": "Standard",
    "pt_status": true,
    "sub_date": "28/01/2025",
    "sub_plan": "Monthly",
    "sub_type": "Individual",
    "time_stamp": "2025-01-28 10:59:12.494"
  },
  {
    "id": "-OHgLnh3B8TTl3pPDX_f",
    "amount": 0,
    "boxing": false,
    "client_key": "5j6NGzGRLq5WkY9ipOi7",
    "exp_date": "28/02/2025",
    "extras_amount": 0,
    "hist_type": "Subscription Paused",
    "history_id": "77891738058450310000",
    "pt_plan": "",
    "pt_status": false,
    "sub_date": "28/01/2025",
    "sub_plan": "Monthly",
    "sub_type": "Individual",
    "time_stamp": "2025-01-28 11:00:50.310"
  },
  {
    "id": "-OHgRex4zyslSNahvnVY",
    "amount": 25000,
    "boxing": false,
    "client_key": "UBLQEfYtLMlFVnunOYgS",
    "exp_date": "28/02/2025",
    "extras_amount": 0,
    "hist_type": "Registration",
    "history_id": "64551738059986954000",
    "pt_plan": "null",
    "pt_status": false,
    "sub_date": "28/01/2025",
    "sub_plan": "Monthly",
    "sub_type": "Individual",
    "time_stamp": "2025-01-28 11:26:27.331"
  },
  {
    "id": "-OHgRqDKDq5iGu5mzbQk",
    "amount": 0,
    "boxing": false,
    "client_key": "UBLQEfYtLMlFVnunOYgS",
    "exp_date": "28/02/2025",
    "extras_amount": 0,
    "hist_type": "Subscription Paused",
    "history_id": "97621738060033495000",
    "pt_plan": "",
    "pt_status": false,
    "sub_date": "28/01/2025",
    "sub_plan": "Monthly",
    "sub_type": "Individual",
    "time_stamp": "2025-01-28 11:27:13.495"
  },
  {
    "id": "-OHgo5K7UHHNYNttWkYB",
    "amount": 20000,
    "boxing": false,
    "client_key": "kiJKYVIVZZO1MGXYIACo",
    "exp_date": "28/02/2025",
    "extras_amount": 0,
    "hist_type": "Renewal",
    "history_id": "29341738066127923000",
    "pt_plan": "null",
    "pt_status": false,
    "sub_date": "28/01/2025",
    "sub_plan": "Monthly",
    "sub_type": "Individual",
    "time_stamp": "2025-01-28 13:08:49.037"
  },
  {
    "id": "-OHgrKBAshdCbY2FKxwa",
    "amount": 2000,
    "boxing": false,
    "client_key": "DihCmRMzQYH28FCP8FBC",
    "exp_date": "29/01/2025",
    "extras_amount": 0,
    "hist_type": "Renewal",
    "history_id": "28641738066975236000",
    "pt_plan": "null",
    "pt_status": false,
    "sub_amount_b4_discount": 3000,
    "sub_date": "28/01/2025",
    "sub_plan": "Daily",
    "sub_type": "Individual",
    "time_stamp": "2025-01-28 13:22:56.500"
  },
  {
    "id": "-OHl9_RmHJrb3Pd_RYfG",
    "amount": 40000,
    "boxing": false,
    "client_key": "FDhmbg1EKokvPb87NXUI",
    "exp_date": "28/02/2025",
    "extras_amount": 15000,
    "hist_type": "Registration",
    "history_id": "63921738139131486000",
    "pt_plan": "Standard",
    "pt_status": true,
    "sub_date": "29/01/2025",
    "sub_plan": "Monthly",
    "sub_type": "Individual",
    "time_stamp": "2025-01-29 09:25:32.230"
  },
  {
    "id": "-OHlBwOt4oe9D9h0ilw1",
    "amount": 3000,
    "boxing": false,
    "client_key": "skgu74tpFSKE4eWEIQUs",
    "exp_date": "30/01/2025",
    "extras_amount": 0,
    "hist_type": "Renewal",
    "history_id": "09631738139749354000",
    "pt_plan": "null",
    "pt_status": false,
    "sub_date": "29/01/2025",
    "sub_plan": "Daily",
    "sub_type": "Individual",
    "time_stamp": "2025-01-29 09:35:50.540"
  },
  {
    "id": "-OHlKCmzDqLDBDA6HWpU",
    "amount": 0,
    "boxing": false,
    "client_key": "FDhmbg1EKokvPb87NXUI",
    "exp_date": "28/02/2025",
    "extras_amount": 0,
    "hist_type": "Subscription Paused",
    "history_id": "26071738141918688000",
    "pt_plan": "",
    "pt_status": false,
    "sub_date": "29/01/2025",
    "sub_plan": "Monthly",
    "sub_type": "Individual",
    "time_stamp": "2025-01-29 10:11:58.689"
  },
  {
    "id": "-OHv7JRbeMYwHccwDbDV",
    "amount": 25000,
    "boxing": false,
    "client_key": "mvhg55Gx6nN9Rg1UajXW",
    "exp_date": "28/02/2025",
    "extras_amount": 0,
    "hist_type": "Registration",
    "history_id": "30571738306308916000",
    "pt_plan": "null",
    "pt_status": false,
    "sub_date": "31/01/2025",
    "sub_plan": "Monthly",
    "sub_type": "Individual",
    "time_stamp": "2025-01-31 07:51:49.465"
  },
  {
    "id": "-OHvDuOiV0i6nE-cvF3g",
    "amount": 20000,
    "boxing": false,
    "client_key": "0al2AorOGFe2nEtbiCMV",
    "exp_date": "28/02/2025",
    "extras_amount": 0,
    "hist_type": "Renewal",
    "history_id": "15051738308036375000",
    "pt_plan": "null",
    "pt_status": false,
    "sub_date": "31/01/2025",
    "sub_plan": "Monthly",
    "sub_type": "Individual",
    "time_stamp": "2025-01-31 08:20:37.765"
  },
  {
    "id": "-OHvXG2BCj83mQHMdtRq",
    "amount": 3000,
    "boxing": false,
    "client_key": "OiknjCfOQNv9j9a79viV",
    "exp_date": "01/02/2025",
    "extras_amount": 0,
    "hist_type": "Renewal",
    "history_id": "76321738313109693000",
    "pt_plan": "null",
    "pt_status": false,
    "sub_date": "31/01/2025",
    "sub_plan": "Daily",
    "sub_type": "Individual",
    "time_stamp": "2025-01-31 09:45:10.283"
  },
  {
    "id": "-OHvYZJlP8qVmWKHxdL9",
    "amount": 3000,
    "boxing": false,
    "client_key": "DPfLyqSZn21lWu3ZlwZG",
    "exp_date": "01/02/2025",
    "extras_amount": 0,
    "hist_type": "Registration",
    "history_id": "02221738313450193000",
    "pt_plan": "null",
    "pt_status": false,
    "sub_date": "31/01/2025",
    "sub_plan": "Daily",
    "sub_type": "Individual",
    "time_stamp": "2025-01-31 09:50:51.378"
  },
  {
    "id": "-OHvZ-BUo2QDTFTi910d",
    "amount": 25000,
    "boxing": false,
    "client_key": "dPE68isk9TWWUoN9UmL8",
    "exp_date": "28/02/2025",
    "extras_amount": 0,
    "hist_type": "Registration",
    "history_id": "09671738313565042000",
    "pt_plan": "null",
    "pt_status": false,
    "sub_date": "31/01/2025",
    "sub_plan": "Monthly",
    "sub_type": "Individual",
    "time_stamp": "2025-01-31 09:52:45.537"
  },
  {
    "id": "-OHvppmBql9QUWAOmEU2",
    "amount": 20000,
    "boxing": false,
    "client_key": "8pEWeGvOC9ULOgmcflfI",
    "exp_date": "28/02/2025",
    "extras_amount": 0,
    "hist_type": "Renewal",
    "history_id": "80301738318241142000",
    "pt_plan": "null",
    "pt_status": false,
    "sub_date": "31/01/2025",
    "sub_plan": "Monthly",
    "sub_type": "Individual",
    "time_stamp": "2025-01-31 11:10:41.620"
  },
  {
    "id": "-OHvtTGOedFTJqNOo1uh",
    "amount": 20000,
    "boxing": false,
    "client_key": "yF4r5GbqltZnM2niNB7d",
    "exp_date": "28/02/2025",
    "extras_amount": 0,
    "hist_type": "Renewal",
    "history_id": "15561738319192473000",
    "pt_plan": "null",
    "pt_status": false,
    "sub_date": "31/01/2025",
    "sub_plan": "Monthly",
    "sub_type": "Individual",
    "time_stamp": "2025-01-31 11:26:33.889"
  },
  {
    "id": "-OHvtyGJV8O9Aw3nxzdS",
    "amount": 2750,
    "boxing": false,
    "client_key": "ZqBbg7Y7hqUrBHITTYne",
    "exp_date": "01/02/2025",
    "extras_amount": 0,
    "hist_type": "Registration",
    "history_id": "74931738319324138000",
    "pt_plan": "null",
    "pt_status": false,
    "sub_date": "31/01/2025",
    "sub_plan": "Daily",
    "sub_type": "Couples",
    "time_stamp": "2025-01-31 11:28:44.957"
  },
  {
    "id": "-OHvuGZZJcjzH66mMmIX",
    "amount": 2750,
    "boxing": false,
    "client_key": "nIvKvkfHO2rlybWFhf2R",
    "exp_date": "01/02/2025",
    "extras_amount": 0,
    "hist_type": "Registration",
    "history_id": "38191738319403534000",
    "pt_plan": "null",
    "pt_status": false,
    "sub_date": "31/01/2025",
    "sub_plan": "Daily",
    "sub_type": "Couples",
    "time_stamp": "2025-01-31 11:30:04.012"
  },
  {
    "id": "-OHvxVlEyzv-M-jV8W7x",
    "amount": 25000,
    "boxing": false,
    "client_key": "ZbG3QOY51haPPR9UOV11",
    "exp_date": "28/02/2025",
    "extras_amount": 0,
    "hist_type": "Registration",
    "history_id": "88421738320252051000",
    "pt_plan": "null",
    "pt_status": false,
    "sub_date": "31/01/2025",
    "sub_plan": "Monthly",
    "sub_type": "Individual",
    "time_stamp": "2025-01-31 11:44:12.696"
  },
  {
    "id": "-OHvxYWHFkk68GXvBEmG",
    "amount": 0,
    "boxing": false,
    "client_key": "ZbG3QOY51haPPR9UOV11",
    "exp_date": "28/02/2025",
    "extras_amount": 0,
    "hist_type": "Subscription Paused",
    "history_id": "72001738320263963000",
    "pt_plan": "",
    "pt_status": false,
    "sub_date": "31/01/2025",
    "sub_plan": "Monthly",
    "sub_type": "Individual",
    "time_stamp": "2025-01-31 11:44:23.963"
  },
  {
    "id": "-OI-ZYuQhdK4k0O3eTXy",
    "amount": 20000,
    "boxing": false,
    "client_key": "Kkvpbqsb7PAfqCqxq5zo",
    "exp_date": "01/03/2025",
    "extras_amount": 0,
    "hist_type": "Renewal",
    "history_id": "93861738397597446000",
    "pt_plan": "null",
    "pt_status": false,
    "sub_date": "01/02/2025",
    "sub_plan": "Monthly",
    "sub_type": "Individual",
    "time_stamp": "2025-02-01 09:13:17.922"
  },
  {
    "id": "-OI20IbxMR9fVJwawD20",
    "amount": 25000,
    "boxing": false,
    "client_key": "mvfpNinnMNu4XwaoVA70",
    "exp_date": "01/03/2025",
    "extras_amount": 0,
    "hist_type": "Registration",
    "history_id": "14921738438688039000",
    "pt_plan": "null",
    "pt_status": false,
    "sub_date": "01/02/2025",
    "sub_plan": "Monthly",
    "sub_type": "Individual",
    "time_stamp": "2025-02-01 20:38:08.406"
  },
  {
    "id": "-OI9myfiqqIJqF33Vvqd",
    "amount": 25000,
    "boxing": false,
    "client_key": "JodwIzTSph6UmHSGWtDE",
    "exp_date": "03/03/2025",
    "extras_amount": 0,
    "hist_type": "Registration",
    "history_id": "15791738569152556000",
    "pt_plan": "null",
    "pt_status": false,
    "sub_date": "03/02/2025",
    "sub_plan": "Monthly",
    "sub_type": "Individual",
    "time_stamp": "2025-02-03 08:52:32.893"
  },
  {
    "id": "-OI9n_jz6460bO3SCkY5",
    "amount": 15000,
    "boxing": false,
    "client_key": "mvhg55Gx6nN9Rg1UajXW",
    "exp_date": "03/03/2025",
    "extras_amount": 0,
    "hist_type": "Personal Training",
    "history_id": "42061738569312913000",
    "pt_plan": "",
    "pt_status": false,
    "sub_date": "03/02/2025",
    "sub_plan": "Standard Plan",
    "sub_type": "",
    "time_stamp": "2025-02-03 08:55:12.913"
  },
  {
    "id": "-OI9oDWD1JBrWIbBjkXY",
    "amount": 0,
    "boxing": false,
    "client_key": "GlZFt6lpNTg7SAVC4v3L",
    "exp_date": "28/02/2025",
    "extras_amount": 0,
    "hist_type": "Subscription Paused",
    "history_id": "73211738569478264000",
    "pt_plan": "",
    "pt_status": false,
    "sub_date": "03/02/2025",
    "sub_plan": "Monthly",
    "sub_type": "Individual",
    "time_stamp": "2025-02-03 08:57:58.264"
  },
  {
    "id": "-OI9w-IZshpM5d2dnoZJ",
    "amount": 40000,
    "boxing": false,
    "client_key": "m5spNxDvyEbkvwSQuo9n",
    "exp_date": "03/03/2025",
    "extras_amount": 15000,
    "hist_type": "Registration",
    "history_id": "04571738571516500000",
    "pt_plan": "Standard",
    "pt_status": true,
    "sub_date": "03/02/2025",
    "sub_plan": "Monthly",
    "sub_type": "Individual",
    "time_stamp": "2025-02-03 09:31:57.885"
  },
  {
    "id": "-OI9xP-F98I1jAhcAx_R",
    "amount": 20000,
    "boxing": false,
    "client_key": "1Zwh6PmoJgW0QlhizchT",
    "exp_date": "03/03/2025",
    "extras_amount": 0,
    "hist_type": "Renewal",
    "history_id": "73571738571883508000",
    "pt_plan": "null",
    "pt_status": false,
    "sub_date": "03/02/2025",
    "sub_plan": "Monthly",
    "sub_type": "Individual",
    "time_stamp": "2025-02-03 09:38:05.290"
  },
  {
    "id": "-OI9yJ-g9eYw_t0JZUrS",
    "amount": 3000,
    "boxing": false,
    "client_key": "skgu74tpFSKE4eWEIQUs",
    "exp_date": "04/02/2025",
    "extras_amount": 0,
    "hist_type": "Renewal",
    "history_id": "04941738572121468000",
    "pt_plan": "null",
    "pt_status": false,
    "sub_date": "03/02/2025",
    "sub_plan": "Daily",
    "sub_type": "Individual",
    "time_stamp": "2025-02-03 09:42:02.884"
  },
  {
    "id": "-OI9zFC6dFamBJAk6l1Z",
    "amount": 20000,
    "boxing": false,
    "client_key": "8qb4NWEe431xhrCh4I5d",
    "exp_date": "03/03/2025",
    "extras_amount": 0,
    "hist_type": "Renewal",
    "history_id": "92251738572368799000",
    "pt_plan": "null",
    "pt_status": false,
    "sub_date": "03/02/2025",
    "sub_plan": "Monthly",
    "sub_type": "Individual",
    "time_stamp": "2025-02-03 09:46:09.439"
  },
  {
    "id": "-OIANIyEMmTGBtbVO0JS",
    "amount": 0,
    "boxing": false,
    "client_key": "ZbG3QOY51haPPR9UOV11",
    "exp_date": "03/03/2025",
    "extras_amount": 0,
    "hist_type": "Subscription Resumed",
    "history_id": "77801738578937772000",
    "pt_plan": "",
    "pt_status": false,
    "sub_date": "03/02/2025",
    "sub_plan": "Monthly",
    "sub_type": "Individual",
    "time_stamp": "2025-02-03 11:35:37.772"
  },
  {
    "id": "-OIBA3EsPzm_bISBx-Qb",
    "amount": 20000,
    "boxing": false,
    "client_key": "KygTyYubo8is7LR9RlHE",
    "exp_date": "28/02/2025",
    "extras_amount": 0,
    "hist_type": "Renewal",
    "history_id": "98201738592241397000",
    "pt_plan": "null",
    "pt_status": false,
    "sub_date": "03/02/2025",
    "sub_plan": "Monthly",
    "sub_type": "Individual",
    "time_stamp": "2025-02-03 15:17:22.536"
  },
  {
    "id": "-OIBKBtW3_wEsHaiisDm",
    "amount": 25000,
    "boxing": false,
    "client_key": "OXgP7IOIiezLkOQRLWuJ",
    "exp_date": "03/03/2025",
    "extras_amount": 0,
    "hist_type": "Registration",
    "history_id": "18581738594899036000",
    "pt_plan": "null",
    "pt_status": false,
    "sub_date": "03/02/2025",
    "sub_plan": "Monthly",
    "sub_type": "Individual",
    "time_stamp": "2025-02-03 16:01:39.409"
  },
  {
    "id": "-OIBKDssVJeuSCfrqEMr",
    "amount": 0,
    "boxing": false,
    "client_key": "OXgP7IOIiezLkOQRLWuJ",
    "exp_date": "03/03/2025",
    "extras_amount": 0,
    "hist_type": "Subscription Paused",
    "history_id": "68261738594907562000",
    "pt_plan": "",
    "pt_status": false,
    "sub_date": "03/02/2025",
    "sub_plan": "Monthly",
    "sub_type": "Individual",
    "time_stamp": "2025-02-03 16:01:47.562"
  },
  {
    "id": "-OIBUpCprWYRtXx2-Sas",
    "amount": 25000,
    "boxing": false,
    "client_key": "RMi1GquPtn03Zx618dlE",
    "exp_date": "03/03/2025",
    "extras_amount": 0,
    "hist_type": "Registration",
    "history_id": "98481738597685500000",
    "pt_plan": "null",
    "pt_status": false,
    "sub_date": "03/02/2025",
    "sub_plan": "Monthly",
    "sub_type": "Individual",
    "time_stamp": "2025-02-03 16:48:05.817"
  },
  {
    "id": "-OIBUrcrAVLGxVYwACS8",
    "amount": 0,
    "boxing": false,
    "client_key": "RMi1GquPtn03Zx618dlE",
    "exp_date": "03/03/2025",
    "extras_amount": 0,
    "hist_type": "Subscription Paused",
    "history_id": "51971738597695743000",
    "pt_plan": "",
    "pt_status": false,
    "sub_date": "03/02/2025",
    "sub_plan": "Monthly",
    "sub_type": "Individual",
    "time_stamp": "2025-02-03 16:48:15.743"
  },
  {
    "id": "-OIBf0S4VMBwfg_UIWev",
    "amount": 20000,
    "boxing": false,
    "client_key": "w9sFIJce3akRidRAqthx",
    "exp_date": "03/03/2025",
    "extras_amount": 0,
    "hist_type": "Renewal",
    "history_id": "55131738600619190000",
    "pt_plan": "null",
    "pt_status": false,
    "sub_date": "03/02/2025",
    "sub_plan": "Monthly",
    "sub_type": "Individual",
    "time_stamp": "2025-02-03 17:36:59.530"
  },
  {
    "id": "-OIBfkqcbEr-QJpjlyvA",
    "amount": 15000,
    "boxing": false,
    "client_key": "w9sFIJce3akRidRAqthx",
    "exp_date": "03/03/2025",
    "extras_amount": 0,
    "hist_type": "Personal Training",
    "history_id": "41151738600813677000",
    "pt_plan": "",
    "pt_status": false,
    "sub_date": "03/02/2025",
    "sub_plan": "Standard Plan",
    "sub_type": "",
    "time_stamp": "2025-02-03 17:40:13.678"
  },
  {
    "id": "-OIBoHGwEChc6Pi9O_Y9",
    "amount": 40000,
    "boxing": false,
    "client_key": "U53O96CIc0YaVuaxa3c9",
    "exp_date": "03/03/2025",
    "extras_amount": 15000,
    "hist_type": "Registration",
    "history_id": "71621738603047409000",
    "pt_plan": "Standard",
    "pt_status": true,
    "sub_date": "03/02/2025",
    "sub_plan": "Monthly",
    "sub_type": "Individual",
    "time_stamp": "2025-02-03 18:17:27.745"
  },
  {
    "id": "-OIBtxFXBHdi1G7pJqHA",
    "amount": 15000,
    "boxing": false,
    "client_key": "OXgP7IOIiezLkOQRLWuJ",
    "exp_date": "03/03/2025",
    "extras_amount": 0,
    "hist_type": "Personal Training",
    "history_id": "97281738604534419000",
    "pt_plan": "",
    "pt_status": false,
    "sub_date": "03/02/2025",
    "sub_plan": "Standard Plan",
    "sub_type": "",
    "time_stamp": "2025-02-03 18:42:14.419"
  },
  {
    "id": "-OIC1j4OJPwwe_nBlVHH",
    "amount": 0,
    "boxing": false,
    "client_key": "p6IpaF3piIbcvOQCvEPR",
    "exp_date": "06/03/2025",
    "extras_amount": 0,
    "hist_type": "Subscription Resumed",
    "history_id": "87311738606835604000",
    "pt_plan": "",
    "pt_status": false,
    "sub_date": "03/02/2025",
    "sub_plan": "Monthly",
    "sub_type": "Individual",
    "time_stamp": "2025-02-03 19:20:35.604"
  },
  {
    "id": "-OIFvlSgbZYUgs2viFrF",
    "amount": 15000,
    "boxing": false,
    "client_key": "XQoBuluGxDkZLRY0aKGf",
    "exp_date": "04/03/2025",
    "extras_amount": 0,
    "hist_type": "Renewal",
    "history_id": "99971738672118430000",
    "pt_plan": "null",
    "pt_status": false,
    "sub_amount_b4_discount": 20000,
    "sub_date": "04/02/2025",
    "sub_plan": "Monthly",
    "sub_type": "Individual",
    "time_stamp": "2025-02-04 13:28:39.570"
  },
  {
    "id": "-OIGKXH_9lYuUzCf28Na",
    "amount": 20000,
    "boxing": false,
    "client_key": "fcVvF6wc2seg8wOTFW0T",
    "exp_date": "04/03/2025",
    "extras_amount": 0,
    "hist_type": "Renewal",
    "history_id": "46201738678872054000",
    "pt_plan": "null",
    "pt_status": false,
    "sub_date": "04/02/2025",
    "sub_plan": "Monthly",
    "sub_type": "Individual",
    "time_stamp": "2025-02-04 15:21:13.209"
  },
  {
    "id": "-OIGi_ePEDZSHc6jW4oK",
    "amount": 25000,
    "boxing": false,
    "client_key": "F31YCuejJbdrbpH2e1Qa",
    "exp_date": "04/03/2025",
    "extras_amount": 0,
    "hist_type": "Registration",
    "history_id": "93941738685440259000",
    "pt_plan": "null",
    "pt_status": false,
    "sub_date": "04/02/2025",
    "sub_plan": "Monthly",
    "sub_type": "Individual",
    "time_stamp": "2025-02-04 17:10:40.601"
  },
  {
    "id": "-OIKED4xI4LrDeB7cRMU",
    "amount": 20000,
    "boxing": false,
    "client_key": "UCpVL6P374fZE6j49HRF",
    "exp_date": "05/03/2025",
    "extras_amount": 0,
    "hist_type": "Renewal",
    "history_id": "96181738744326574000",
    "pt_plan": "null",
    "pt_status": false,
    "sub_date": "05/02/2025",
    "sub_plan": "Monthly",
    "sub_type": "Individual",
    "time_stamp": "2025-02-05 09:32:07.238"
  },
  {
    "id": "-OILHuF1qJLhqOibuLEV",
    "amount": 0,
    "boxing": false,
    "client_key": "cRI1UYaVfSa6HXeYBy4Y",
    "exp_date": "22/02/2025",
    "extras_amount": 0,
    "hist_type": "Subscription Paused",
    "history_id": "07791738762068387000",
    "pt_plan": "",
    "pt_status": false,
    "sub_date": "05/02/2025",
    "sub_plan": "Monthly",
    "sub_type": "Individual",
    "time_stamp": "2025-02-05 14:27:48.388"
  },
  {
    "id": "-OIPO3nnv_hjPx-_MPo7",
    "amount": 20000,
    "boxing": false,
    "client_key": "dClfVgvOfqJiI6n8WrB7",
    "exp_date": "06/03/2025",
    "extras_amount": 0,
    "hist_type": "Renewal",
    "history_id": "99191738830795425000",
    "pt_plan": "null",
    "pt_status": false,
    "sub_date": "06/02/2025",
    "sub_plan": "Monthly",
    "sub_type": "Individual",
    "time_stamp": "2025-02-06 09:33:15.798"
  },
  {
    "id": "-OIR8fTaMqJTMrEqY-05",
    "amount": 20000,
    "boxing": false,
    "client_key": "wkPxUYb8VkxDg3cL4aHS",
    "exp_date": "06/03/2025",
    "extras_amount": 0,
    "hist_type": "Renewal",
    "history_id": "80131738860310187000",
    "pt_plan": "null",
    "pt_status": false,
    "sub_date": "06/02/2025",
    "sub_plan": "Monthly",
    "sub_type": "Individual",
    "time_stamp": "2025-02-06 17:45:11.415"
  },
  {
    "id": "-OIR8k_WjwRhtuvvb1vs",
    "amount": 20000,
    "boxing": false,
    "client_key": "PnonLR2VylIcd9GA3aSu",
    "exp_date": "06/03/2025",
    "extras_amount": 0,
    "hist_type": "Renewal",
    "history_id": "67761738860331629000",
    "pt_plan": "null",
    "pt_status": false,
    "sub_date": "06/02/2025",
    "sub_plan": "Monthly",
    "sub_type": "Individual",
    "time_stamp": "2025-02-06 17:45:32.343"
  },
  {
    "id": "-OIRC2hvLGCtDPTw0crV",
    "amount": 20000,
    "boxing": false,
    "client_key": "3RAmYTkPdojERdUmfFhA",
    "exp_date": "06/03/2025",
    "extras_amount": 0,
    "hist_type": "Renewal",
    "history_id": "04751738861196344000",
    "pt_plan": "null",
    "pt_status": false,
    "sub_date": "06/02/2025",
    "sub_plan": "Monthly",
    "sub_type": "Individual",
    "time_stamp": "2025-02-06 17:59:56.980"
  },
  {
    "id": "-OIRClzBLbUckB2a4RJC",
    "amount": 0,
    "boxing": false,
    "client_key": "FDhmbg1EKokvPb87NXUI",
    "exp_date": "08/03/2025",
    "extras_amount": 0,
    "hist_type": "Subscription Resumed",
    "history_id": "65941738861386501000",
    "pt_plan": "",
    "pt_status": false,
    "sub_date": "06/02/2025",
    "sub_plan": "Monthly",
    "sub_type": "Individual",
    "time_stamp": "2025-02-06 18:03:06.501"
  },
  {
    "id": "-OIRCvdTCTy86li3GRQD",
    "amount": 0,
    "boxing": false,
    "client_key": "5j6NGzGRLq5WkY9ipOi7",
    "exp_date": "09/03/2025",
    "extras_amount": 0,
    "hist_type": "Subscription Resumed",
    "history_id": "27691738861426073000",
    "pt_plan": "",
    "pt_status": false,
    "sub_date": "06/02/2025",
    "sub_plan": "Monthly",
    "sub_type": "Individual",
    "time_stamp": "2025-02-06 18:03:46.073"
  },
  {
    "id": "-OIRFFcMWUbwZ48MapCe",
    "amount": 15000,
    "boxing": false,
    "client_key": "KHtHO9rcfU63vS27vCBw",
    "exp_date": "06/03/2025",
    "extras_amount": 15000,
    "hist_type": "Renewal",
    "history_id": "08701738862034122000",
    "pt_plan": "Standard",
    "pt_status": true,
    "sub_date": "06/02/2025",
    "sub_plan": "HMO Plan",
    "sub_type": "HMO Plan",
    "time_stamp": "2025-02-06 18:13:56.300"
  },
  {
    "id": "-OIRFWAF_HLLnbVWNzGe",
    "amount": 3000,
    "boxing": false,
    "client_key": "skgu74tpFSKE4eWEIQUs",
    "exp_date": "07/02/2025",
    "extras_amount": 0,
    "hist_type": "Renewal",
    "history_id": "39931738862103097000",
    "pt_plan": "null",
    "pt_status": false,
    "sub_date": "06/02/2025",
    "sub_plan": "Daily",
    "sub_type": "Individual",
    "time_stamp": "2025-02-06 18:15:04.074"
  },
  {
    "id": "-OIUdYyNUuG7EWp5E4W_",
    "amount": 20000,
    "boxing": false,
    "client_key": "U2orJygIdCDKdetkomRj",
    "exp_date": "04/03/2025",
    "extras_amount": 0,
    "hist_type": "Renewal",
    "history_id": "62531738919000839000",
    "pt_plan": "null",
    "pt_status": false,
    "sub_date": "07/02/2025",
    "sub_plan": "Monthly",
    "sub_type": "Individual",
    "time_stamp": "2025-02-07 10:03:22.484"
  },
  {
    "id": "-OIUel3ayjVcQsaa1eEf",
    "amount": 15000,
    "boxing": false,
    "client_key": "JodwIzTSph6UmHSGWtDE",
    "exp_date": "07/03/2025",
    "extras_amount": 0,
    "hist_type": "Personal Training",
    "history_id": "61291738919318278000",
    "pt_plan": "",
    "pt_status": false,
    "sub_date": "07/02/2025",
    "sub_plan": "Standard Plan",
    "sub_type": "",
    "time_stamp": "2025-02-07 10:08:38.278"
  },
  {
    "id": "-OIZeOIGnKHNrxKEzGFv",
    "amount": 25000,
    "boxing": false,
    "client_key": "oqMXWC745zoVVLCblpPI",
    "exp_date": "08/03/2025",
    "extras_amount": 0,
    "hist_type": "Registration",
    "history_id": "51461739003099887000",
    "pt_plan": "null",
    "pt_status": false,
    "sub_date": "08/02/2025",
    "sub_plan": "Monthly",
    "sub_type": "Individual",
    "time_stamp": "2025-02-08 09:25:08.342"
  },
  {
    "id": "-OIZj7r4IIQCjz5vitPT",
    "amount": 40000,
    "boxing": false,
    "client_key": "aLZ4UIHWMIEINPfP1v0G",
    "exp_date": "08/03/2025",
    "extras_amount": 15000,
    "hist_type": "Registration",
    "history_id": "09911739004351067000",
    "pt_plan": "Standard",
    "pt_status": true,
    "sub_date": "08/02/2025",
    "sub_plan": "Monthly",
    "sub_type": "Individual",
    "time_stamp": "2025-02-08 09:45:51.338"
  },
  {
    "id": "-OIZjA0mAM0w0gq_zzJ2",
    "amount": 0,
    "boxing": false,
    "client_key": "aLZ4UIHWMIEINPfP1v0G",
    "exp_date": "08/03/2025",
    "extras_amount": 0,
    "hist_type": "Subscription Paused",
    "history_id": "19151739004360218000",
    "pt_plan": "",
    "pt_status": false,
    "sub_date": "08/02/2025",
    "sub_plan": "Monthly",
    "sub_type": "Individual",
    "time_stamp": "2025-02-08 09:46:00.218"
  },
  {
    "id": "-OIZzeaSqYkp4HeJUOLS",
    "amount": 2000,
    "boxing": false,
    "client_key": "DihCmRMzQYH28FCP8FBC",
    "exp_date": "09/02/2025",
    "extras_amount": 0,
    "hist_type": "Renewal",
    "history_id": "41911739008682360000",
    "pt_plan": "null",
    "pt_status": false,
    "sub_amount_b4_discount": 3000,
    "sub_date": "08/02/2025",
    "sub_plan": "Daily",
    "sub_type": "Individual",
    "time_stamp": "2025-02-08 10:58:03.528"
  },
  {
    "id": "-OI_-N2TbBfSi1G2Kmu-",
    "amount": 25000,
    "boxing": false,
    "client_key": "pRmVDg46wsFgIrOqPYKc",
    "exp_date": "08/03/2025",
    "extras_amount": 0,
    "hist_type": "Registration",
    "history_id": "81361739008869333000",
    "pt_plan": "null",
    "pt_status": false,
    "sub_date": "08/02/2025",
    "sub_plan": "Monthly",
    "sub_type": "Individual",
    "time_stamp": "2025-02-08 11:01:09.705"
  },
  {
    "id": "-OI_-RO67J98SgLxKTWy",
    "amount": 0,
    "boxing": false,
    "client_key": "pRmVDg46wsFgIrOqPYKc",
    "exp_date": "08/03/2025",
    "extras_amount": 0,
    "hist_type": "Subscription Paused",
    "history_id": "92921739008887475000",
    "pt_plan": "",
    "pt_status": false,
    "sub_date": "08/02/2025",
    "sub_plan": "Monthly",
    "sub_type": "Individual",
    "time_stamp": "2025-02-08 11:01:27.475"
  },
  {
    "id": "-OI_7y8rcygmkzaOAcRi",
    "amount": 3000,
    "boxing": false,
    "client_key": "PFmRrY5nfjHzKAYJRviy",
    "exp_date": "09/02/2025",
    "extras_amount": 0,
    "hist_type": "Renewal",
    "history_id": "68921739011122375000",
    "pt_plan": "null",
    "pt_status": false,
    "sub_date": "08/02/2025",
    "sub_plan": "Daily",
    "sub_type": "Individual",
    "time_stamp": "2025-02-08 11:38:42.825"
  },
  {
    "id": "-OIj909Ro91OGTqucDQ6",
    "amount": 0,
    "boxing": false,
    "client_key": "GlZFt6lpNTg7SAVC4v3L",
    "exp_date": "07/03/2025",
    "extras_amount": 0,
    "hist_type": "Subscription Resumed",
    "history_id": "22851739179168745000",
    "pt_plan": "",
    "pt_status": false,
    "sub_date": "10/02/2025",
    "sub_plan": "Monthly",
    "sub_type": "Individual",
    "time_stamp": "2025-02-10 10:19:28.745"
  },
  {
    "id": "-OIj9hFhsRLJnTTaS3mr",
    "amount": 20000,
    "boxing": false,
    "client_key": "7KDCWUZuKwe2M3U4YKGz",
    "exp_date": "10/03/2025",
    "extras_amount": 0,
    "hist_type": "Renewal",
    "history_id": "04511739179348062000",
    "pt_plan": "null",
    "pt_status": false,
    "sub_date": "10/02/2025",
    "sub_plan": "Monthly",
    "sub_type": "Individual",
    "time_stamp": "2025-02-10 10:22:29.373"
  },
  {
    "id": "-OIk7ReWKFpqxARB5rra",
    "amount": 20000,
    "boxing": false,
    "client_key": "s22Zbj5EUVyxotGSSzkY",
    "exp_date": "10/03/2025",
    "extras_amount": 0,
    "hist_type": "Renewal",
    "history_id": "68981739195532829000",
    "pt_plan": "null",
    "pt_status": false,
    "sub_date": "10/02/2025",
    "sub_plan": "Monthly",
    "sub_type": "Individual",
    "time_stamp": "2025-02-10 14:52:14.591"
  },
  {
    "id": "-OIkFgv_uA8MUssYpFQs",
    "amount": 20000,
    "boxing": false,
    "client_key": "CBvE8sJ9Q5Og0Hb1COhR",
    "exp_date": "10/03/2025",
    "extras_amount": 0,
    "hist_type": "Renewal",
    "history_id": "25081739197697200000",
    "pt_plan": "null",
    "pt_status": false,
    "sub_date": "10/02/2025",
    "sub_plan": "Monthly",
    "sub_type": "Individual",
    "time_stamp": "2025-02-10 15:28:18.378"
  },
  {
    "id": "-OIkTOsWBu5g85t3S6Xw",
    "amount": 20000,
    "boxing": false,
    "client_key": "FOq2hecmypSX2WZaw1Kp",
    "exp_date": "10/03/2025",
    "extras_amount": 0,
    "hist_type": "Renewal",
    "history_id": "24341739201287943000",
    "pt_plan": "null",
    "pt_status": false,
    "sub_date": "10/02/2025",
    "sub_plan": "Monthly",
    "sub_type": "Individual",
    "time_stamp": "2025-02-10 16:28:09.341"
  },
  {
    "id": "-OIkfOXt4DzGcy5fXNyV",
    "amount": 20000,
    "boxing": false,
    "client_key": "OqeZgt4f2Yq3lT52cJrG",
    "exp_date": "10/03/2025",
    "extras_amount": 0,
    "hist_type": "Renewal",
